id,label,left_title,right_title
1,0,Automatikuhr Max Bill@de "Junghans Automatikuhr Bill 027/4700.00 nur 925 00 €"@de,Max Bill Automatic Acier/Noir - Junghans@fr-fr Junghans 027/3400.00"@fr-fr
2,1, Mens Nixon The Crew Watch A1186-001 New arrivals | Shop New Hut", Mens Nixon The Crew Watch A1186-001 Sale | Hut"
3,0, Classic Diamond Tennis Bracelet in 14k White Gold (7) "@en "Classic | Shane Co."@en, Link and Round Diamond Ring @en "Link | Shane Co."@en
4,0,SUUNTO AMBIT 3 PEAK BLACK HR@de HR - TREKKING GPS Suunto Farbe Schwarz SS020674000 Der Online-Shop für deine Sportbekleidung"@de,Suunto Core All Black Military Men's Outdoor Sports Watch - SS014279010 "Electronics & Gadgets | Running Outlet Express"
5,0,DREAMNIGHT@es " Swatch? México - Chrono (? 40 47 MM) DREAMNIGHT YCS485GC "@es, Unisex Swatch Flexiblack Watch LB183B Latest Mens Watches"
6,1,Daniel Wellington Classic Man Sheffield silver@en-GB silver 10:35 Watch boutique"@en-GB,Sheffield Silver Reloj para hombre 40mm@es 00 €"@es "Daniel Wellington Sheffield 40mm nur 149
7,0, Automatic small second Steel on leather strap @en-US "Maestro - Silver Leather Black Watch Raymond Weil"@en-US,Raymond Weil Maestro Watch 2227-STC-00659 "Shop Raymond 2227-STC-00659 Watches | Costello Jewelry Company"
8,0,Jazzmaster Day Date Herren-Automatikuhr@de "Hamilton Jazzmaster Herren-Automatikuhr nur 675 00 €"@de,JAZZMASTER MAESTRO AUTOCHRONO@es AUTOCHRONO - Tomas Colomer"@es
9,0,Michele Deco Mid Watch MWW06V000003 "Shop Michele MWW06V000002 Watches | Costello Jewelry Company",Michele Deco Mid Watch MW06V00A0029_MS16DM235009 "Shop Michele MW06V00A0029_MS16DM235009 Watches | Costello Jewelry Company"
10,1, MAUR?CE LACRO?X AI1018PVY11132-1 Erkek Kol Saati @tr "Maurice Lacroix En Ucuz Fiyat"@tr,Mens Aikon Chronograph Watch @de "Maurice Lacroix Schweizer hergestellt luxuri?s Uhren - including Pontos Miros Fiaba und Les Classique ranges"@de
11,0,Cartier Santos De Cartier Galbée Watch W20012C4 "Shop W20056D6 Watches | Northeastern Fine Jewelry",Cartier Tank Louis Cartier Watch W1529756 "Shop WGTA0010 Watches | Northeastern Fine Jewelry"
12,0, Princess Cut Diamond Ring @en "Princess | Shane Co."@en, 5mm Cultured Freshwater Pearl  Black Agate and Sterling Silver Necklace (47) "@en | Shane Co."@en "5mm Pearl
13,0,Herren Tissot Visodate Automatik Uhr T0194303603101@de,Tissot Couturier Quartz T035.410.11.051.00 Gent@es "Reloj Tissot Gent catálogo oficial Laguardajoiers distribuidor de en Barcelona"@es
14,1,Daniel Wellington Classic Man Oxford rose gold@en-GB gold 10:35 Watch boutique"@en-GB,Herren Daniel Wellington Oxford 40mm Uhr DW00100001@de
15,0,Maurice Lacroix Les Classiques Watch LC6027-SS001-121 "Shop Maurice LC6027-SS001-320 Watches | Costello Jewelry Company",Maurice Lacroix Les Classiques Watch LC1087-SS002-120-1 "Shop Maurice LC1087-SS001-120-1 Watches | Costello Jewelry Company"
16,1,Klokers KLOK-02 Watch KLOK-02-KLINK-02-380C6 "Shop Klokers KLOK-02-KLINK-01-MC7 Watches | Costello Jewelry Company",Klokers KLOK-02 Watch KLOK-02-KLINK-02-380C6 "Shop Klokers KLOK-02-KLINK-02-380C8 Watches | Costello Jewelry Company"
17,0,Mens Promaster Navihawk GPS Alarm Chronograph Radio Controlled Eco-Drive Watch @de "Citizen Uhren"@de,Mens Red Arrows World Time Chronograph Eco-Drive Watch @de "Fathers Tag - Uhren und gift ideas"@de
18,0,Alpina Automatic 4 Watch AL-525BS5AQ6 "Shop Alpina AL-525BS5AQ6B | Moyer Fine Jewelers",Alpina Automatic 4 Watch AL-525NS5AQ6 "Shop Alpina AL-525BS5AQ6 | Moyer Fine Jewelers"
19,0,Diver Automatyczny Zegarek do nurkowania@pl 00 €"@pl "Seiko Diver nurkowania SKX007K2 nur 299,Kinetic GMT Diver′s Reloj para hombre@es 00 €"@es "Seiko Kinetic hombre SUN021P1 nur 599
20,1,Rolex Milgauss 116400 GV GV Watch | Watchfinder & Co.",RolexNEW ROLEX MILGAUSS ANNIVERSARY EDITION MENS WATCH 116400GV  "Rolex"
21,0,Daniel Wellington Classic Lady Winchester rose gold@nl-NL gold 10:35 Horloge boektiek"@nl-NL,Daniel Wellington Classic Lady Canterbury rose gold@nl-NL gold 10:35 Horloge boektiek"@nl-NL
22,0,Raymond Weil Toccata Watch 5388-ST-50081 "Shop Raymond 5988-ST-00300 Watches | Costello Jewelry Company",Raymond Weil Toccata Watch 5988-P-97081 "Shop Raymond 5388-SPS-97081 Watches | Costello Jewelry Company"
23,1,ArtCarved Classic Engagement Ring 31-V734ERW-E "Shop ArtCarved 31-V378FRW-E rings | Northeastern Fine Jewelry",ArtCarved Classic Engagement Ring 31-V734ERW-E "Shop ArtCarved 31-V405ERW-E rings | Northeastern Fine Jewelry"
24,0,Zegarek m?ski Le Locle@pl "Tissot Zegarek Locle T41.1.483.53 nur 475 00 €"@pl,Tissot "TissotTissot Swiss Made Wrist Watch T048.417.27.057.01 43mm"
25,0, Casio Men's G-Shock Alarm Chronograph Watch@en "Men's Watch (GA-100B-4AER) - WATCH SHOP.com?"@en,G-Shock reloj para hombre Master of G Oversized@es 90 €"@es "Casio G-Shock Oversized nur 99
26,0,Raymond Weil Toccata Watch 5988-STP-97081 "Shop Raymond 5388-SPS-97081 Watches | Costello Jewelry Company",Raymond Weil Toccata Watch 5388-ST-50081 "Shop Raymond 5988-P-97081 Watches | Costello Jewelry Company"
27,0,Seiko Prospex Sea SRPA21K1 watch,Seiko Men's SKX007K2 Diver's Automatic Watch "Sport Watches - Page 5 | All Fitness Gadgets"
28,1,Mens Red Arrows World Time Chronograph Eco-Drive Watch @de "Citizen Uhren"@de,Mens Red Arrows World Time Chronograph Eco-Drive Watch @de "Fathers Tag - Uhren und gift ideas"@de
29,0,Bvlgari Bvlgari Watch BBL262TBSS 12.M BBL33WSPGD | Dejaun Jewelers",Bvlgari B.Zero1 Watch BZ23WSGDL 12 BZ23WSGS 12.M | Dejaun Jewelers"
30,0,Rolex Submariner 116610LN " Pre-loved Rolex 116610LN watch at Albemarle Bond,RolexNEW ROLEX MILGAUSS ANNIVERSARY EDITION MENS WATCH 116400GV  "Rolex"
31,0,Cartier Tank Francaise W50002N2 W50002N2 Watch | Watchfinder & Co.",Cartier Tank Americaine W2603556 W2603556 Watch | Watchfinder & Co."
32,0,Mr. Daddy 2.0 Zegarek m?ski@pl 00 €"@pl "Diesel Mr. m?ski DZ7350 nur 349,Kinetic Herrenuhr@de 00 €"@de "Seiko Kinetic Herrenuhr SKA531P1 nur 329
33,1,Freja Zegarek damski@pl "Skagen Freja damski 358SGGD nur 111 20 €"@pl,Ladies Freja Watch @de "Skagen Uhren und Schmuck | Official SKAGEN Stockist"@de
34,0,Timex Men's Ironman 10-Lap Watch,Omega Constellation Watch 123.10.35.60.02.001 "Watch Finder"
35,0,Tissot Gents le Locle Automatic Black Dial Watch,Tissot T Classic Couturier @en
36,0,Meister Driver Chronoscope Reloj automático@es "Junghans Meister automático nur 1.990 00 €"@es,Automatikuhr Max Bill@de "Junghans Automatikuhr Bill 027/7700.00 nur 955 00 €"@de
37,0, Mens Michel Herbelin Inspiration 1947 70th Anniversary Limited Edition Mechanical Watch 1947/P11MA New arrivals | Shop New The Hut",NEC Slot-in PC 100013751 - Prijzen @NL Tweakers"@NL
38,1, Automatic small second Steel on leather strap @en-US "Maestro - Silver Leather Black Watch Raymond Weil"@en-US,Raymond Weil Maestro Watch 2238-STC-00659 "Shop Raymond 2238-STC-00659 Watches | Costello Jewelry Company"
39,0,Cartier Santos 100 W20107X7 W20107X7 Watch | Watchfinder & Co.",Cartier Ronde Louis Cartier Watch W6800151 "Shop WR000251 Watches | Northeastern Fine Jewelry"
40,0,Longines Conquest Watch L3.697.4.76.6 "Shop Longines L3.700.4.96.6 Watches | Northeastern Fine Jewelry",Cartier Tank MC Watch W5330007 "Shop Cartier WSTA0010 Watches | Northeastern Fine Jewelry"
41,0,Tissot T Classic Couturier @en,Herren Tissot Quickster Chronograf Uhr T0954171703701@de
42,0,Classic Black Sheffield Silver 40mm@en "Daniel Wellington Classic 40mm nur € 189.00"@en,Daniel Wellington Classic Man Sheffield silver@nl-NL silver | 10:35 Horloge boetiek"@nl-NL
43,0,G-Shock Men′s Watch@en "Casio G-Shock Watch GA-100CF-1A9ER nur € 129.00"@en,Mens G-Shock Rangeman Alarm Chronograph Radio Controlled Watch @de "Fathers Tag - Uhren und gift ideas"@de
44,0,Omega Speedmaster Watch 311.92.44.51.01.005 "Speedmaster",Omega Seamaster 23332412101002 " Discover the Omega watch collection at Albemarle Bond
45,0,Daniel Wellington Classic Lady Bristol rose gold@nl-NL gold | 10:35 Horloge boetiek"@nl-NL,Daniel Wellington Classic Lady Glasgow rose gold@nl-NL gold 10:35 Horloge boektiek"@nl-NL
46,0,Reading Oro Rosé Reloj para mujer 36mm@es "Daniel Wellington Reading 36mm nur 169 00 €"@es,Montre Daniel Wellington  Canterbury unisexe@fr Wellington unisexe - W0502DW"@fr
47,0,CASIO LA670WEA-7EF@fr-fr  " MR JONES QUEEN LTD EDITION "@fr-fr  CYCLOPS SUMMER NIGHT TOKYOFLASH KISAI BLADE DARK... SUN AND MOON G-SHOCK GMA-S110CM-3AER COUNT DOWN CLOCK NIGHT... G-8900-1ER BABY-G BGD-501UM-3ER KAKI GMA-S110CM-8AER MARU... DAWN WEST DUSK THE LAST LAUGH KING BA-110 SERIES BLACK BGD-501UM-2ER NAVY /... SPACE... SATELLITE ADJUST... LAPS VANITE GOLD BLUE TIME TRAVELLER DW-5600 POLARIZED... LAUGH... ALL GOLD... AVERAGE DAYS GMA-S110CM-2AER TRICOLOR "@fr-fr LA670WEA-7EF - Chez maman"@fr-fr, Junghans Men's Max Bill Automatic Watch@en "Men's Watch (027/4700.00) - WATCH SHOP.com?"@en
48,0,Eco-Drive Men′s Watch Radio Controlled@en "Citizen Eco-Drive Controlled nur € 399.00"@en,Promaster Marine Men′s -Divers′ Watch@en "Citizen Promaster Watch nur € 159.20"@en
49,0,Ladies Classic Dream Watch @de "Tissot T-klassisch Uhren | Official TISSOT Stockist"@de,Valiant Automatic Watch 40mm@en "Hamilton Valiant 40mm H39515134 nur € 545.00"@en
50,1,Rolex Submariner 116610LN " Buy Rolex 116610 watches online at Albemarle Bond,Rolex Submariner 116610LN " Pre-loved Rolex 116610LN watch at Albemarle Bond
51,1,Daniel Wellington Classic Lady Winchester rose gold@nl-NL gold 10:35 Horloge boektiek"@nl-NL,Daniel Wellington Classic Lady Winchester rose gold@en-GB gold 10:35 Watch boutique"@en-GB
52,0, Unisex DKNY Minetta Watch NY2502 Mens Sale Watches",DKNY NY2287 Stanhope watch
53,0,Tissot "TissotTissot Swiss Made Wrist Watch T048.417.27.057.01 43mm",RELOJ TISSOT T-RACE PARA CABALLERO@es "reloj tissot t-race para caballero T0484172705706-Bizzarro Momentos inolvidables"@es
54,1,Tortoise Watch@en "Michael Kors Tortoise Watch | SHOPBOP"@en,Tortoise Watch@en "Michael Kors Tortoise Watch | SHOPBOP SAVE UP TO 30% Use Code: MORE17"@en
55,0, Pulsar Men's Watch@en "Men's Watch (PJ6019X1) - WATCH SHOP.com?"@en, Pulsar Men's Chronograph Watch@en "Men's Watch (PT3161X1) - WATCH SHOP.com?"@en
56,0,G-Shock Zegarek m?ski@pl 00 €"@pl "Casio G-Shock m?ski GA-110GB-1AER nur 149,G-Shock Speed Shifter reloj para hombre@es "Casio G-Shock hombre nur 95 00 €"@es
57,1,Bvlgari Bvlgari Watch BBL26WSSD BBL33WSL 12 | Dejaun Jewelers",Bvlgari Bvlgari Watch BBL26WSSD BBL33WSS 12 | Dejaun Jewelers"
58,1,Cartier Santos 100 Watch W20107X7 "Shop Cartier W20073X8 Watches | Northeastern Fine Jewelry",Cartier Santos 100 Watch W20107X7 "Shop Cartier W20106X8 Watches | Northeastern Fine Jewelry"
59,0,Max Bill Reloj para mujer@es "Junghans Max mujer 047/4657.00 nur 495 00 €"@es, Unisex Gucci Dive Watch YA136215 Ladies Watches | Designer For Women The Hut"
60,1,Rolex GMT Master 116710LN " Luxury Rolex watches Pre-loved at Albemarle Bond,Rolex GMT-Master II 116710 "116710LN | Rolex Men's Watch"
61,1,Fossil ES3487 watch,Jacqueline Damenuhr@de 00 €"@de "Fossil Jacqueline Damenuhr ES3487 nur 119
62,0,Polar USA Unisex FT4 Green/Green Watch@en-US "Fitness Technology | Fitness Gear Express"@en-US,Samsung Gear Fit2 SmartWatch (Large)  Black (Certified Refurbished)@en-US "Other Tech Accessories - Page 1461 | All Toys"@en-US
63,0,Cartier Santos W20011C4 W20011C4 Watch | Watchfinder & Co.",Cartier  "CartierCartier Classic Santos Series Men's Watch W20055D6"
64,0,Maurice Lacroix Les Classiques Watch LC6027-SS001-121 "Shop Maurice LC6027-SS001-121 Watches | Costello Jewelry Company",Maurice Lacroix Les Classiques Watch LC6098-SS001-120-1 "Shop Maurice LC6098-SS001-121-1 Watches | Costello Jewelry Company"
65,0,Tag Heuer Carrera WAR5010.BA0723 WAR5010.BA0723 Watch | Watchfinder & Co.", TAG HEUER CARRERA（卡萊拉系列） Calibre 7兩地時間 自動上鏈腕錶 100米 - ?41毫米 WAR2012.BA0723 @zh-hant "TAG Heuer（泰格豪雅） Carrera Automatic Watch 41毫米 | watch price"@zh-hant
66,0, Reloj Drive Sugar de acero @es "Reloj - Tous"@es,Eco-Drive Herrenuhr@de "Citizen Eco-Drive Herrenuhr AW1360-04E nur 139 00 €"@de
67,1,Carl F Bucherer AutoDate TwoTone Watch 00.10621.07.77.21 "Shop Carl 00.10621.07.77.31 Watches | Costello Jewelry Company",Carl F Bucherer AutoDate TwoTone Watch 00.10621.07.77.21 "Shop Carl 00.10621.07.77.21 | Moyer Fine Jewelers"
68,0, Unisex Casio Classic Collection Alarm Chronograph Watch LA670WEGB-1BEF Mens Sale Watches",CASIO LA670WEA-7EF@fr-fr  " MR JONES QUEEN LTD EDITION "@fr-fr  CYCLOPS SUMMER NIGHT TOKYOFLASH KISAI BLADE DARK... SUN AND MOON G-SHOCK GMA-S110CM-3AER COUNT DOWN CLOCK NIGHT... G-8900-1ER BABY-G BGD-501UM-3ER KAKI GMA-S110CM-8AER MARU... DAWN WEST DUSK THE LAST LAUGH KING BA-110 SERIES BLACK BGD-501UM-2ER NAVY /... SPACE... SATELLITE ADJUST... LAPS VANITE GOLD BLUE TIME TRAVELLER DW-5600 POLARIZED... LAUGH... ALL GOLD... AVERAGE DAYS GMA-S110CM-2AER TRICOLOR "@fr-fr LA670WEA-7EF - Chez maman"@fr-fr
69,0,Chopard Moonphases Watch 161934-5001 161927-5001 | Dejaun Jewelers",Chopard Superfast Watch 161291-5001 161284-5001 | Dejaun Jewelers"
70,1, Mens Raymond Weil Tradition Watch 5466-ST-00608 Mens Watches", Raymond Weil Men's Tradition Watch@en "Men's Watch (5466-ST-00608) - WATCH SHOP.com?"@en
71,0,Chopard Mille Miglia 168997-3001 168997-3001 Watch | Watchfinder & Co.",Chopard Happy Sport Chrono Watch 288499-3001 283583-5006 | Dejaun Jewelers"
72,0,Automatik Diver′s Herrenuhr@de "Seiko Automatik Herrenuhr SRP639K1 nur 395 00 €"@de,Zegarek m?ski Kinetic@pl 00 €"@pl "Seiko Zegarek Kinetic SKA531P1 nur 329
73,0, TAG HEUER AQUARACER Calibre 5 Automatic Watch 300 M - ?41 mmCeramic Bezel WAY211B.FC6363 @en-us "TAG Heuer Aquaracer 41 mm | watch price"@en-us,Tag Heuer Carrera WAR201A.BA0723 WAR201A.BA0723 Watch | Watchfinder & Co."
74,1,Edifice Reloj para hombre Solar Bluetooth@es "Casio Edifice Bluetooth nur 399 00 €"@es,Edifice Zegarek m?ski S?oneczna energia Bluetooth@pl 00 €"@pl "Casio Edifice Bluetooth nur 399
75,0, Mens Nixon The Crew Watch A1186-2761 Latest Watches", Unisex Swatch Flexiblack Watch LB183B Ladies Watches | Designer For Women The Hut"
76,0,Cartier Drive De Cartier Watch W4100013 "Shop WGNM0006 Watches | Northeastern Fine Jewelry",Cartier Hypnose Watch WJHY0006 "Shop Cartier WJHY0003 Watches | Northeastern Fine Jewelry"
77,1,Hamilton Thin Line H38511133,Herren Hamilton Jazzmaster Thinline Uhr H38511133@de
78,0,G-Shock Herrenuhr@de "Casio G-Shock Herrenuhr GA-800-4AER nur 129 00 €"@de,G-Shock Reloj para hombre@es "Casio G-Shock hombre GA-400-1BER nur 129 00 €"@es
79,1,Unisex Forerunner 235 HR GPS Bluetooth Alarm Chronograph Watch @de "Fitness Uhren"@de,Unisex Forerunner 235 HR GPS Bluetooth Alarm Chronograph Watch @de "Herren Sport Uhren"@de
80,0, Unisex DKNY Minetta Watch NY2502 Mens Sale Watches",Herrenuhr@de 90 €"@de "Casio Herrenuhr DB-360GN-9AEF nur 64
81,0, Valentino RED Blue Knit Fabric Bow Sleeveless Dress Size S @en "RED - Yoogi's Closet"@en, Citizen Ladies' Dress Eco-Drive Watch@en "Ladies' Watch (FE1081-08A) - WATCH SHOP.com?"@en
82,0,Omega Seamaster 212.30.44.50.03.001,Bartlettyarns Maine Wool Yarn color 2300@en Yarn"@en
83,0,暢銷款 TAG HEUER CARRERA（卡萊拉系列） Calibre 5星期-日曆 自動上鏈腕錶 100米 - ?41毫米 WAR201A.BA0723 @zh-hant "TAG Heuer（泰格豪雅） Carrera Automatic Watch 41毫米 | watch price"@zh-hant, TAG HEUER FORMULA 1 Calibre 7 Relógio Automático 200 M - ?41 mm WAZ211A.BA0875 @pt "TAG Heuer Formula Automatic Watch 41 | watch price"@pt
84,0,Chopard Happy Sport Mini Watch 278509-6003 278509-6006 | Dejaun Jewelers",Chopard Superfast Watch 161291-5001 168535-3002 | Dejaun Jewelers"
85,0,Skagen SKW6285 Holst watch, Mens Skagen Signatur Regulator Watch SKW6390 Men's Watches | Designer For Men The Hut"
86,0,Manifesto Love Uhr Blau@de "Versace Manifesto Blau für Damen | DE Online Store"@de,Red Palazzo Empire Watch@en "Versace Red Watch for Women | UK Online Store"@en
87,1, Mens Casio G-Shock Mudman Alarm Chronograph Watch G-9300-1ER All Watches",Reloj digital para hombre@es "Casio Reloj hombre G-9300-1ER nur 199 00 €"@es
88,0, GC Ladies Lady Chic Chronograph Watch @en "GC Y05010M1 ￡219.00 - TheWatchSuperstore.com?"@en,Herren Emporio Armani Chronograf Uhr AR1737@de
89,1,Daniel Wellington Classic Lady Sheffield rose gold@nl-NL gold 10:35 Horloge boektiek"@nl-NL,Daniel Wellington Classic Lady Sheffield rose gold@nl-NL gold | 10:35 Horloge boetiek"@nl-NL
90,0,Apple Watch Nike+  38mm Gris espacial Aluminio Funda Negro/Volt Nike Sport Correa@es "A. 42mm Alum. Plata C. Platino/b - Black Friday 2017 "@es,Chopard Happy Sport Chrono Watch 288499-6002 283583-5006 | Dejaun Jewelers"
91,0,Ladies Day Dream Watch @de "Folli Follie Uhren und Schmuck | Official FOLLI FOLLIE Stockist"@de, Tissot Men's PR100 Powermatic 80 Automatic Watch@en "Men's Watch (T1014072203100) - WATCH SHOP.com?"@en
92,0,Kinetic GMT Reloj para hombre@es 00 €"@es "Seiko Kinetic hombre SUN015P1 nur 479,Zegarek m?ski Kinetic@pl 00 €"@pl "Seiko Zegarek Kinetic SKA531P1 nur 329
93,0,Hamilton Jazzmaster Regulator Auto Watch H42615553 "Shop Hamilton Collection at Safa Jewelers", Hamilton Ladies' Jazzmaster Lady 30mm Watch@en "Ladies' Watch (H42211155) - WATCH SHOP.com?"@en
94,1,Solar Cronógrafo para hombre@es "Seiko Solar hombre SSC431P1 nur 329 00 €"@es,Solar Herrenchronograph@de "Seiko Solar Herrenchronograph SSC431P1 nur 329 00 €"@de
95,1,POLAR M400 HR CON SENSORE H7 H7 | Tradineur.com", POLAR Unisex M400 Bluetooth GPS Activity Tracker Heart Rate Bundle Smart Alarm Chronograph Watch @en "POLAR 90051341 ￡157.50 - TheWatchSuperstore.com?"@en
96,1,Grenen Men′s Watch@en "Skagen Grenen Watch 233XXLSLB nur € 139.00"@en,Skagen Watch - 233XXLSLB Grenen Leather@en Leather | TQ Diamonds"@en
97,0,Chopard Happy Sport Mini Watch 278509-6003 278509-3007 | Dejaun Jewelers",Chopard Superfast Watch 161291-5001 161284-5001 | Dejaun Jewelers"
98,0,Diesel DZ7350 Mr. Daddy 2.0 watch,Diesel DZ1440 Double Down watch
99,0,IL "@en-US " Online Store | Distinctive Gold Jewelry in Frankfort,JAZZMASTER AUTO CHRONO@es CHRONO - Tomas Colomer"@es
100,1,reloj para hombre de titanio@es "Seiko reloj titanio SGG731P1 nur 209 00 €"@es,Zegarek m?ski z tytanu@pl 00 €"@pl "Seiko Zegarek tytanu SGG731P1 nur 209
101,1,Dior Chiffre Rouge Watch CD084C10A002 CD084510A004 | Dejaun Jewelers",Dior Chiffre Rouge Watch CD084C10A002 CD084B10M001 | Dejaun Jewelers"
102,0,Daniel Wellington Classic Lady silver@nl-NL silver | 10:35 Horloge boetiek"@nl-NL,Daniel Wellington Classic Lady York silver@en-GB silver 10:35 Watch boutique"@en-GB
103,0,South Horizons Uhr Blau/Kristall@de "Versus Versace South Blau/Kristall für Damen | Online Store EU"@de, Ladies Karl Lagerfeld Joleigh Watch KL3409 Latest Mens Watches"
104,0,Michele Deco Mid Watch MWW06V000001 "Shop Michele MWW06V000042 Watches | Northeastern Fine Jewelry",Michele Deco Mid MW06V00A0029_MS16DM235009
105,0,Cartier Tortue Watch W1556363 "Shop Cartier W1556361 Watches | Northeastern Fine Jewelry",Cartier Drive De Cartier Watch W4100013 "Shop WGNM0003 Watches | Northeastern Fine Jewelry"
106,0,Automatik Diver′s Herrenuhr@de "Seiko Automatik Herrenuhr SRP581K1 nur 399 00 €"@de,Hombre-Reloj automático@es "Seiko Hombre-Reloj automático SRP705K1 nur 279 00 €"@es
107,1,Suunto M5 Womens - Black/Lime@en " Suunto Accessories Black/Lime "@en, SUUNTO SS019863000 Erkek Kol Saati @tr "Suunto En Ucuz Fiyat"@tr
108,0,Chopard Happy Sport Chrono Watch 288499-6002 283581-5007 | Dejaun Jewelers",Chopard Happy Sport Chrono Watch 288499-3001 288499-3016 | Dejaun Jewelers"
109,0,Raymond Weil Noemia Watch 5132-STP-00985 "Shop Raymond 5132-ST-50081 Watches | Costello Jewelry Company",Raymond Weil Tango Watch 8160-ST-00608 "Shop Raymond 8160-ST-00608 Watches | Costello Jewelry Company"
110,0,Raymond Weil Maestro Watch 2238-STC-00659 "Shop Raymond 2227-STC-00659 Watches | Costello Jewelry Company",Raymond Weil Maestro Watch 2237-ST-BEAT1 "Shop Raymond 2238-PC5-00209 Watches | Costello Jewelry Company"
111,0,Unisex Casio klassisch Wecker Chronograf Uhr A500WEA-1EF@de, Montre noire & dorée LA670WEGB-1BEF - Casio @fr "Fête des pères"@fr
112,0, Ladies Raymond Weil Jasmine Watch 5229-STS-01659 Raymond Watches", Unisex Gucci Dive Watch YA136215 Luxury Mens Watches"
113,0,Diesel DZ1440 Double Down watch,York Rosegold Herrenuhr 40mm@de 00 €"@de "Daniel Wellington York 40mm nur 139
114,1,Alpina Diver 300 Automatic Watch AL-525LGG4V6 "Shop Alpina AL-525LBG4V6 | Moyer Fine Jewelers",Alpina SEASTRONG DIVER 300 AL-525LGG4V6@en
115,1,Damen Daniel Wellington Glasgow Rose 36mm Uhr DW00100031@de,Glasgow Ró?owe z?oto Zegarek damski 36mm@pl 00 €"@pl "Daniel Wellington Glasgow 36mm nur 139
116,0,Seiko Astron GPS Solar Chronograph SSE025J1@en Seiko SSE025J1 Limited Edition prices and watches official catalog"@en,Solar Cronógrafo para hombre@es "Seiko Solar hombre SSC437P1 nur 239 00 €"@es
117,0,Crosswalk Stainless Steel Women's Watch @en " Gray 'stanhope' Ceramic Bracelet, Steel Plate Round Watch with black Leather strap @en "Plate Round"@en
118,0,Cartier Calibre De Cartier Diver Watch W2CA0009 "Shop W7100052 Watches | Northeastern Fine Jewelry",Cartier Tortue Watch W1556363 "Shop Cartier WGTO0003 Watches | Northeastern Fine Jewelry"
119,1,The Crew All Rose Gold / Cream@en "Nixon The Cream A1186-2761 nur € 199.00"@en, Mens Nixon The Crew Watch A1186-2761 New arrivals | Shop New Hut"
120,1,Hamilton AC Jazzmaster Regulator Auto@es Auto - Tomas Colomer"@es,Hamilton Regulator H42615553 "Regulator"
121,1,Daniel Wellington DW00100089 Dapper York watch, Daniel Wellington Men's Dapper 38mm York Watch@en "Men's Watch (DW00100089) - WATCH SHOP.com?"@en
122,0, Daniel Wellington Men's Dapper 38mm York Watch@en "Men's Watch (DW00100089) - WATCH SHOP.com?"@en,Daniel Wellington Dapper Durham silver@en-GB silver 10:35 Watch boutique"@en-GB
123,1,Daniel Wellington Classic Man Glasgow silver@en-GB silver 10:35 Watch boutique"@en-GB,Herren Daniel Wellington Glasgow Silber 40mm Uhr DW00100018@de
124,0,Suunto M2 Black/Lime Watch SS020647000 @en | Dutyfreeislandshop.com"@en,Suunto Core Watches@en Watches | Sportsman's Warehouse"@en
125,0,Alpina Automatic 4 Watch AL-525SS5AQ6 "Shop Alpina AL-525NS5AQ6B | Moyer Fine Jewelers",Alpina Automatic 4 Watch AL-525NS5AQ6 "Shop Alpina AL-525BS5AQ6B | Moyer Fine Jewelers"
126,0,Michele Serein Diamond Gold Watch "Dynamic Filter",Michele Deco Mid Watch MWW06V000003 "Shop Michele MW06V00A0029_MS16DM235009 Watches | Costello Jewelry Company"
127,0,Longines Master Collection Watch L2.628.4.51.7 "Shop Longines L2.128.4.57.6 Watches | Northeastern Fine Jewelry",Cartier Santos-Dumont Watch WH100351 "Shop Cartier W2009251 Watches | Northeastern Fine Jewelry"
128,0, Raymond Weil Men's Tradition Watch@en "Men's Watch (5466-ST-00608) - WATCH SHOP.com?"@en,Raymond Weil Tango Watch 8160-ST-00608 "Shop Raymond 8160-STP-00308 Watches | Costello Jewelry Company"
129,1,Casio PRG-300-1A2ER@bg PRG-300-1A2ER | Pro Trek Stotak.com"@bg,Mens Casio Pro-Trek Alarm Chronograph Watch PRG-300-1A2ER
130,0, Ladies Sekonda Editions Watch 2463 Sale | The Hut",American Standard - R890@en
131,0,Maurice Lacroix Les Classiques Watch LC1087-SS002-120-1 "Shop Maurice LC1087-SD501-160 Watches | Costello Jewelry Company",Raymond Weil Tango Watch 8160-ST-00608 "Shop Raymond 8160-ST-00608 Watches | Costello Jewelry Company"
132,1,Engineer Hydrocarbon Ceramic XV@en "Ball Watch | Engineer XV - Model DM2136A-SCJ-BK"@en,Mens Engineer Hydrocarbon Ceramic XV Chronometer Automatic Watch @de "Chronometer COSC Rated mechanisch Uhren"@de
133,0,Apple Watch Nike+  38mm Gris espacial Aluminio Funda Negro/Volt Nike Sport Correa@es 42mm Pebble Band - Black Friday 2017 "@es,Chopard Happy Sport Mini Watch 278509-6003 278509-3007 | Dejaun Jewelers"
134,1,Omega Seamaster 25418000 " Discover the Omega watch collection at Albemarle Bond,Omega Seamaster 300m 2541.80.00 2541.80.00 Watch | Watchfinder & Co."
135,0,Seiko SRP775K1 Prospex Mar Diver's@en "Prospex Sea Seiko Automatic Diver's SRP775K1"@en,Kinetic GMT Diver′s Zegarek m?ski@pl 00 €"@pl "Seiko Kinetic m?ski SUN021P1 nur 599
136,0,Michele Serein Mid Watch MWW21B000009 "Shop Michele MW21B01D2963_MS16DH315750 Watches | Costello Jewelry Company",Michele Deco Mid Diamond Watch "Dynamic Filter"
137,0,Alpina Startimer Pilot Automatic Watch AL-725GR4S6 "Shop Alpina AL-725B4S6B | Moyer Fine Jewelers",Alpina Automatic 4 Watch AL-525NS5AQ6 "Shop Alpina AL-525BS5AQ6B | Moyer Fine Jewelers"
138,0,Mens Casio G-Shock Premium Mudmaster Compass Alarm Chronograph Radio Controlled Watch GWG-1000-1A3ER,G-Shock Mudman Herrenuhr@de "Casio G-Shock Herrenuhr G-9300-1ER nur 199 00 €"@de
139,1,Henry Glitz Chronograph Watch@en "Marc by Marc Jacobs Henry Watch | SHOPBOP"@en,Henry Glitz Chronograph Watch@en "Marc by Marc Jacobs Henry Watch | SHOPBOP SAVE UP TO 30% Use Code: MORE17"@en
140,0, M200 Bluetooth GPS Activity Tracker Heart Rate Monitor Watch @de "Herren Sport Uhren"@de, Unisex Gucci Dive Watch YA136215 Luxury Mens Watches"
141,0,Alpina Startimer Pilot Automatic Watch AL-725B4S6B "Shop Alpina AL-525S4S6 | Moyer Fine Jewelers",Alpina STARTIMER CHRONOGRAPH AL-725GR4S6@en
142,0,Raymond Weil Toccata Watch 5388-ST-50081 "Shop Raymond 5988-SP5-97081 Watches | Costello Jewelry Company", Ladies Raymond Weil Toccata Diamond Watch 5988-P-97081 Raymond Watches"
143,0,Maurice Lacroix LC6098-SS001-130-2 Les Classiques Date@en "LC6098-SS001-130-2 | Maurice Watch LC6098-SS001-130-2. Watches in barcelona catalog with prices."@en,Maurice Lacroix Les Classiques Watch LC1087-SS002-120-1 "Shop Maurice LC1087-SD501-160 Watches | Costello Jewelry Company"
144,0,The Sentry 38 SS Dorado Black Sunray Reloj para hombre@es "Nixon The hombre nur 199 00 €"@es,Cambridge Oro Rosé Reloj para hombre 40mm@es 00 €"@es "Daniel Wellington Cambridge 40mm nur 159
