id,label,left_title,right_title
849,0, Casio Men's G-Shock Alarm Chronograph Watch@en "Men's Watch (G-2900F-2VER) - WATCH SHOP.com?"@en, Casio Men's G-Shock Alarm Chronograph Watch@en "Men's Watch (GA-100CF-1A9ER) - WATCH SHOP.com?"@en
850,0,Maurice Lacroix Fiaba Watch FA2164-SS002-113 "Shop Maurice FA1004-PVP23-170 Watches | Costello Jewelry Company",Maurice Lacroix Les Classiques Watch LC6098-SS001-120-1 "Shop Maurice LC6158-SS001-130-1 Watches | Costello Jewelry Company"
851,0,Edifice Herrenuhr schwarz@de "Casio Edifice schwarz EF-125D-1AVEF nur 69 90 €"@de,Wave Ceptor men′s radio controlled watch@en "Casio Wave watch nur € 69.90"@en
852,1, DAN?EL WELL?NGTON DW00100149 Kol Saati @tr "Daniel Wellington En Ucuz Fiyat"@tr,Daniel Wellington Classic Man Black Cornwall silver@nl-NL silver 10:35 Horloge boektiek"@nl-NL
853,0, Daniel Wellington Men's Cambridge 40mm Watch@en "Men's Watch (DW00100003) - WATCH SHOP.com?"@en, Daniel Wellington Men's Classic 40mm Reading Watch@en "Men's Watch (DW00100028) - WATCH SHOP.com?"@en
854,1,Hamilton American Classic Valiant Auto Watch H39415654 H39515134", Hamilton Ladies' Valiant Automatic Watch@en "Ladies' Watch (H39415654) - WATCH SHOP.com?"@en
855,0, Unisex Suunto Spartan Wrist HR Barometer Bluetooth Chronograph Watch SS050000000 Men's Watches | Designer For Men The Hut", Unisex Gucci G-Timeless Watch YA1264018 Men's Watches | Designer For Men The Hut"
856,0, Montre cuivrée B640WC-5AEF - Casio @fr "TIC TAC"@fr, Casio Men's G-Shock Alarm Chronograph Watch@en "Men's Watch (GA-110LPA-1AER) - WATCH SHOP.com?"@en
857,0,Daniel Wellington Classic Lady Reading rose gold@nl-NL gold 10:35 Horloge boektiek"@nl-NL,Glasgow Ró?owe z?oto Zegarek damski 36mm@pl 00 €"@pl "Daniel Wellington Glasgow 36mm nur 139
858,0,Classic Black Sheffield Rose Gold 36mm@en "Daniel Wellington Classic 36mm nur € 169.00"@en, DAN?EL WELL?NGTON DW00100137 Kol Saati @tr "Daniel Wellington En Ucuz Fiyat"@tr
859,0,Seiko Prospex Turtle Automatic 24 Jewels 200m Divers Black Dial Men's Watch SRP775K1 @en SRP775K | Dutyfreeislandshop.com"@en,Prospex Diver′s Revival Automatikuhr@de 00 €"@de "Seiko Prospex Automatikuhr SRP777K1 nur 399
860,0,Cartier Roadster W62025V3 W62025V3 Watch | Watchfinder & Co.",Cartier  "CartierCartier Classic Santos Series Men's Watch W20098D6"
861,0,Cartier Ronde Croisière de Cartier Watch WSRN0002 "Shop WSRN0002 Watches | Northeastern Fine Jewelry",Cartier Ronde Solo W6801005 W6801005 Watch | Watchfinder & Co."
862,0,Montre Femme Daniel Wellington Classic Durham/ Doré@fr femme Durham /,Daniel Wellington Classic Lady Black Sheffield rose gold@en-GB gold 10:35 Watch boutique"@en-GB
863,0,Mens G-Shock Premium Gulfmaster Alarm Chronograph Radio Controlled Watch @de "Fathers Tag - Uhren und gift ideas"@de,Mens Casio G-Shock Premium Mudmaster Compass Alarm Chronograph Radio Controlled Watch GWG-1000-1A3ER
864,0,Daniel Wellington Classic Man Black Sheffield rose gold@nl-NL gold | 10:35 Horloge boetiek"@nl-NL,Daniel Wellington Classic Lady Black Sheffield silver@en-GB silver 10:35 Watch boutique"@en-GB
865,1,Chopard Happy Sport Medium Automatic Watch 278559-6003 274891-1001 | Dejaun Jewelers",Chopard Happy Sport Medium Automatic Watch 278559-6003 278559-3004 | Dejaun Jewelers"
866,0, Mens Sekonda Watch 1350 Sale | The Hut", Mens Marea Watch 54088/3 Brands"
867,0,Dior Chiffre Rouge Watch CD084B10M001 CD084510A003 | Dejaun Jewelers",Bvlgari Solotempo Watch BGOP38WGLD BGO41BSLD | Dejaun Jewelers"
868,0,Solar Herrenchronograph@de "Seiko Solar Herrenchronograph SSC437P1 nur 239 00 €"@de,Kinetic Herrenuhr@de 00 €"@de "Seiko Kinetic Herrenuhr SKA531P1 nur 329
869,1, TAG HEUER CARRERA Calibre 8 GMT Reloj automático 100 M - ?41 mm WAR5010.BA0723 @es "TAG Heuer Carrera Automatic Watch 41 | watch price"@es,Tag Heuer Carrera WAR5010.BA0723 WAR5010.BA0723 Watch | Watchfinder & Co."
870,1,Damen Raymond Weil Noemia 24mm Diamant Uhr 5124-ST-00985@de, Ladies Raymond Weil Noemia 24mm Diamond Watch 5124-ST-00985 Raymond Watches"
871,0,Max Bill Quarz Men′s Watch@en "Junghans Max Watch 041/4462.00 nur € 495.00"@en,G-Shock Reloj para hombre@es 90 €"@es "Casio G-Shock hombre GA-100MB-1AER nur 99
872,0,Raymond Weil Maestro Watch 2227-STC-00659 "Shop Raymond 2237-ST-65001 Watches | Costello Jewelry Company",Raymond Weil Maestro Watch 2237-STC-20001 "Shop Raymond 2238-ST-00659 Watches | Costello Jewelry Company"
873,0, Daniel Wellington Men's Cambridge Silver 40mm Watch@en "Men's Watch (DW00100017) - WATCH SHOP.com?"@en,York Silver Reloj para mujer 36mm@es "Daniel Wellington York 36mm nur 169 00 €"@es
874,0, Mens Marea Watch 54088/3 All Watches", Ladies Karl Lagerfeld Joleigh Watch KL3409 Latest Mens Watches"
875,0,Omega Master Co-Axial 41?mm@en-GB,Omega Seamaster Planet Ocean @en
876,0, Mens Raymond Weil Freelancer Automatic Watch 2740-ST-50021 Mens Watches",Raymond Weil Toccata Watch 5488-STC-50001 "Shop Raymond 5488-SL5-65001 Watches | Costello Jewelry Company"
877,0, Unisex Welder The Moody 38mm Watch K55/WRC625 Ladies Watches | Designer For Women Hut",Max Bill Reloj para mujer@es "Junghans Max mujer 047/4657.00 nur 495 00 €"@es
878,1, Mens Raymond Weil Freelancer Automatic Watch 2740-ST-50021 Mens Watches",Raymond Weil Freelancer Watch 2740-ST-50021 "Shop Raymond 2754-SR-05500 Watches | Costello Jewelry Company"
879,0,HamiltonHamilton Swiss Movement Watch H37512131 44mm  "Hamilton",Hamilton AC Jazzmaster Seaview Quartz@es Quartz - Tomas Colomer"@es
880,1,Pyle Sports PHRM38SL Heart Rate Monitor Watch with Minimum  Average Rate  Calories  Target Zones  Silver@en-US "Health Monitors - Page 31 | Medical Outlet Direct"@en-US,PYLE - Sports Watch Silver@en-US
881,1,Apple Watch Nike+  38mm Gris espacial Aluminio Funda Negro/Volt Nike Sport Correa@es 42mm Pebble Band - Black Friday 2017 "@es,Apple Watch Nike+  38mm Gris espacial Aluminio Funda Negro/Volt Nike Sport Correa@es Nik... "@es Nike+
882,0, null Hampton Diverter and Personal Shower Rough Valve Only@en-US, Unisex Swatch Flexiblack Watch LB183B Latest Mens Watches"
883,1,ArtCarved Classic Engagement Ring 31-V219ERW-E "Shop ArtCarved 31-V378FRW-E rings | Northeastern Fine Jewelry",ArtCarved Classic Engagement Ring 31-V219ERW-E "Shop ArtCarved 31-V736ERW-E rings | Northeastern Fine Jewelry"
884,1,Fossil ES3745 Georgia watch,Georgia Damenuhr@de "Fossil Georgia Damenuhr ES3745 nur 129 00 €"@de
885,1,Cartier Tank Américaine Watch WB710009 "Shop Cartier WB710008 Watches | Northeastern Fine Jewelry",Cartier Tank Américaine Watch WB710009 "Shop Cartier WB710014 Watches | Northeastern Fine Jewelry"
886,0,Hamilton Gent Quartz H32451751 "Gent Quartz",JAZZMASTER AUTO CHRONO@es "reloj hamilton"@es
887,0,Bvlgari LVCEA Watch LU33C6SSPGD LUP33BGGD | Dejaun Jewelers",Chopard Happy Sport Chrono Watch 288499-6002 288499-3016 | Dejaun Jewelers"
888,0,Custom 3 Birthstone Heart Family Tree Necklace Pendant | Eve's Addiction?",SUUNTO AMBIT 3 SPORT BLACK HR@en HR - RUNNING GPS-WATCH Suunto colour Black SS020678000 Athletic footwear apparel and sports equipment"@en
889,0,Herren Daniel Wellington klassisch 36mm Durham Uhr DW00100112@de,Daniel Wellington Classic Lady Black Bristol rose gold@nl-NL gold 10:35 Horloge boektiek"@nl-NL
890,0,ICONIQUE TAG HEUER CARRERA Calibre 01 Chronographe automatique 100 M - ?45 mm CAR2A1Z.FT6044 @fr "TAG Heuer Carrera Automatic Chronograph 45 | watch price"@fr,Cartier  "CartierCartier New Santos Series Men's Watch W20090 x 8"
891,0,Tissot Couturier Quartz T035.410.11.051.00 Gent@es "Reloj Tissot Gent catálogo oficial Laguardajoiers distribuidor de en Barcelona"@es,T-Touch Expert Solar Herrenuhr@de "Tissot T-Touch Herrenuhr nur 940 00 €"@de
892,0,Casio Unisex Digital Bracelet Watch A500WEA-1EF,Collection Men′s Watch@en "Casio Collection Watch A168WEGC-5EF nur € 64.90"@en
893,0,Formula 1 Lady ?32 mm Cerámica y diamantes  esfera blanca  cuarzo,Tag Heuer Carrera CAR2A10.BA0799 CAR2A10.BA0799 Watch | Watchfinder & Co."
894,0,Carl F Bucherer Peripheral Watch 00.10917.08.73.11 "Shop Carl 00.10917.08.33.21 | Moyer Fine Jewelers",Carl F Bucherer Power Reserve Watch 00.10912.08.33.21 "Shop Carl 00.10912.08.13.21 | Moyer Fine Jewelers"
895,0,Hamilton Jazzmaster Seaview Quartz Watch H37451141 H37411111",Hamilton AC Jazzmaster Lady Auto@es Auto - Tomas Colomer"@es
896,1,Mens Engineer Hydrocarbon Airborne Chronometer Watch @de "Ball Uhren | Official BALL Stockist"@de,Mens Engineer Hydrocarbon Airborne Chronometer Watch @de "Chronometer COSC Rated mechanisch Uhren"@de
897,0,Reloj Tissot para Hombre de la colección T-Touch Classic@es Classic - Tomas Colomer"@es,Reloj Tissot para Hombre de la colección Couturier@es Couturier - Tomas Colomer"@es
898,0,ArtCarved Classic Engagement Ring 31-V734ERW-E "Shop ArtCarved 31-V743ERRR-E rings | Northeastern Fine Jewelry",Cartier Tortue Watch WA501012 "Shop Cartier WA501009 Watches | Northeastern Fine Jewelry"
899,0,Daniel Wellington Classic Lady Canterbury rose gold@nl-NL gold | 10:35 Horloge boetiek"@nl-NL,Classic Black Durham Oro Rosé 36mm@es "Daniel Wellington Classic 36mm nur 169 00 €"@es
900,1, Mens Marea Watch 54088/3 Brands", Mens Marea Watch 54088/3 All Watches"
901,0,G-Shock Reloj para hombre@es "Casio G-Shock hombre GA-400-1BER nur 129 00 €"@es,Herren Casio G-Shock Wecker Chronograf Uhr GA-110LPA-1AER@de
902,0,Cartier Rotonde De Cartier Watch W1556051 "Shop W1556238 Watches | Northeastern Fine Jewelry",Cartier Drive De Cartier Watch W4100013 "Shop WSNM0009 Watches | Northeastern Fine Jewelry"
903,0,Unisex Loop 2 Smoky Black Bluetooth Activity Tracker Alarm Watch @de "Fitness Uhren"@de,TomTom Runner 2 Cardio GPS & Heart Rate + Music Watch Black - Small Strap@en Strap · TomTom Run ah"@en
904,0,Kenneth Cole 10022304 Ladies Classic watch,Hamilton Jazzmaster Lady Quartz Watch H42211155 H32341975"
905,1,Damen Hamilton Jazzmaster Dame 34mm Uhr H32351115@de,Hamilton Jazzmaster Lady Quartz Watch H32351115
906,0, Unisex Swatch Flexiblack Watch LB183B Latest Mens Watches", Mens Sekonda Watch 1350 Sale | The Hut"
907,0,NEC Slot-In PC 100013751 2.2GHz 2000E 900g Negro cliente liviano@es "HP ProDisplay P203 20" HD+ TN pantalla para - Black Friday... "@es, Ladies Karl Lagerfeld Joleigh Watch KL3409 Ladies Watches | Designer For Women The Hut"
908,0,Cartier Tank Fran?aise Watch W51008Q3 "Shop Cartier W51008Q3 Watches | Northeastern Fine Jewelry",Cartier Tank Solo Watch W5200025 "Shop Cartier W5200025 Watches | Northeastern Fine Jewelry"
909,0,Bvlgari Bvlgari Soltempo Watch BB39WSPGD BB41C3SLD | Dejaun Jewelers",Bvlgari Bvlgari Watch BBL26WSSD BBL262TBSS.M | Dejaun Jewelers"
910,1,Cronoscope Max Bill@en "Junghans Cronoscope Bill 027/7800.00 nur € 1 695.00"@en,JUNGHANS MAX BILL CHRONOSCOPE GOLD@fr-fr GOLD - Chez maman"@fr-fr
911,0,Omega Seamaster 300m 2541.80.00 2541.80.00 Watch | Watchfinder & Co.",Omega Seamaster 25998000 " Discover the Omega watch collection at Albemarle Bond
912,1, Junghans Men's max bill Handwinding Mechanical Watch@en "Men's Watch (027/5703.00) - WATCH SHOP.com?"@en, LTHR SUPPLY T1 - ROSE... @fr-fr  CASIO BLACK WHITE MQ24-9BLCK "JUNGHANS MAX BILL MECANIQUE GOLD"@fr-fr  LIP MACH2000 MINI MOON /... "@fr-fr GOLD Chez maman"@fr-fr
913,0,G-SHOCK Mudmaster@fr "Montre outdoor g-shock mudmaster casio noir et rouge à partir de 229 00?€"@fr, Mens Casio G-Shock Premium Mudmaster Compass Alarm Chronograph Radio Controlled Watch GWG-1000-1A3ER All Watches"
914,1,Automatikuhr Max Bill@de 00 €"@de "Junghans Automatikuhr Bill 027/4002.44 nur 955,Reloj Max Bill@es "Junghans Reloj Bill 027/4002.44 nur 955 00 €"@es
915,1,Cartier Pasha W31077U2 W31077U2 Watch | Watchfinder & Co.",Cartier "CartierCartier Pasha Series Men's Watch W31077U2"
916,0,Raymond Weil Maestro Watch 2237-ST-BEAT1 "Shop Raymond 2237-ST-20001 Watches | Costello Jewelry Company",Raymond Weil Toccata Watch 5388-PC5-65001 "Shop Raymond 5988-ST-97081 Watches | Costello Jewelry Company"
917,0,Raymond Weil Toccata Watch 5388-PC5-65001 "Shop Raymond 5388-PC5-65001 Watches | Costello Jewelry Company",Raymond Weil Tango @en
918,1,G Shock Rangeman Men′s Watch@en "Casio G Watch GW-9400-1ER nur € 299.00"@en,Mens G-Shock Rangeman Alarm Chronograph Radio Controlled Watch @de "Fathers Tag - Uhren und gift ideas"@de
919,0,Alpina Automatic 4 Watch AL-525BS5AQ6 "Shop Alpina AL-525NS5AQ6B | Moyer Fine Jewelers",Alpina STARTIMER CHRONOGRAPH AL-725GR4S6@en
920,0,Omega Seamaster 25418000 " Discover the Omega watch collection at Albemarle Bond,Omega Master Co-Axial 41?mm@en-GB
921,1,Cartier Santos 100 Watch WSSA0006 "Shop Cartier W20106X8 Watches | Northeastern Fine Jewelry",Cartier Santos 100 Watch WSSA0006 "Shop Cartier W20107X7 Watches | Northeastern Fine Jewelry"
922,1,Omega Seamaster 25998000 " Discover the Omega watch collection at Albemarle Bond,Omega Seamaster Chrono Diver 2599.80.00 2599.80.00 Watch | Watchfinder & Co."
923,0,Raymond Weil Freelancer Watch 7754-TIC-05209 "Shop Raymond 2754-SR-05200 Watches | Costello Jewelry Company", Mens Raymond Weil Maestro Automatic Watch 2237-ST-20001 Mens Watches"
924,0,York Rosegold Herrenuhr 40mm@de 00 €"@de "Daniel Wellington York 40mm nur 139,Daniel Wellington Classic Lady Reading rose gold@nl-NL gold | 10:35 Horloge boetiek"@nl-NL
925,1, Monin Roasted Chestnut Syrup Monin Syrup",Shadow Rose Oversize T-Shirt@de-DE T-Shirt - Phoenix Clothing Online Shop"@de-DE
926,0,TIMELESS CLASSIC VALIANT AUTO@es AUTO - Tomas Colomer"@es,Hamilton American Classic Valiant Auto Watch H39415654 H39515734"
927,0, Ladies Michael Kors Darci Watch MK3192 All Watches",Tortoise Watch@en "Michael Kors Tortoise Watch | SHOPBOP SAVE UP TO 30% Use Code: MORE17"@en
928,1,Michele Deco Mid Watch MW06V00A0029_MS16DM235009 "Shop Michele MWW06V000001 Watches | Costello Jewelry Company",Michele Deco Mid Watch MW06V00A0029_MS16DM235009 "Shop Michele MWW06V000003 Watches | Northeastern Fine Jewelry"
929,0,Cartier Tank Fran?aise Watch W4TA0009 "Shop Cartier W51005Q4 Watches | Northeastern Fine Jewelry",Cartier Tank MC Watch W5330007 "Shop Cartier W5330007 Watches | Northeastern Fine Jewelry"
930,0,Bvlgari Bvlgari Watch BBL37C11SPG 12 BBL33WSL 12 | Dejaun Jewelers",Bvlgari Bvlgari Watch BBL262TBSS 12.M BBL33WSSD | Dejaun Jewelers"
931,0,Seiko Sportura GPS Solar SSF003 / SSF003J1 Herrenuhr@de,Zegarek m?ski Kinetic@pl 00 €"@pl "Seiko Zegarek Kinetic SKA531P1 nur 329
932,1, Folli Follie Ladies' Day Dream Watch@en "Ladies' Watch (6015.1508) - WATCH SHOP.com?"@en,Ladies Day Dream Watch @de "Folli Follie Uhren und Schmuck | Official FOLLI FOLLIE Stockist"@de
933,0,Cartier Santos de Cartier Galbée Watch W20012C4 "Shop W20012C4 Watches | Northeastern Fine Jewelry",Cartier Tank Louis Cartier Watch W1529756 "Shop W1529756 Watches | Northeastern Fine Jewelry"
934,0,The C45 SS Gunmetal / Aqua Sunray Men′s Watch@en "Nixon The Watch nur € 199.00"@en, Seiko Sportura SUN015P1 Kinetic watch Seiko - Kinetic"
935,0, Citizen Men's Eco-Drive Watch@en "Men's Watch (BM7193-07B) - WATCH SHOP.com?"@en, Pulsar Men's Chronograph Watch@en "Men's Watch (PT3195X1) - WATCH SHOP.com?"@en
936,0,Splashy Dolphins Kinderuhr@de "Flik Flak Splashy Kinderuhr FBNP035 nur 40 00 €"@de, Unisex Swatch Flexiblack Watch LB183B Latest Mens Watches"
937,0, TAG HEUER FORMULA 1（F1系列） 200米 - ?41毫米 WAZ1110.BA0875 @zh-hant "TAG Heuer（泰格豪雅） Formula 1 41毫米 | watch price"@zh-hant,Tag Heuer Carrera WAR201A.BA0723 WAR201A.BA0723 Watch | Watchfinder & Co."
938,0,Alpina Pilot Quartz Chronograph Watch AL-372N4FBS6 "Shop Alpina AL-372LBBG4FBV6 | Moyer Fine Jewelers",Alpina Automatic 4 Watch AL-525BS5AQ6 "Shop Alpina AL-525BS5AQ6 | Moyer Fine Jewelers"
939,0,The C45 SS Gunmetal / Aqua Sunray Zegarek m?ski@pl 00 €"@pl "Nixon The m?ski nur 199,The Time Teller Chrono Black Sunray@en "Nixon The Sunray A9722348 nur € 151.20"@en
940,1,Longines Conquest Watch L3.697.4.76.6 "Shop Longines L3.277.4.76.6 Watches | Northeastern Fine Jewelry",Longines Conquest Watch L3.697.4.76.6 "Shop Longines L3.697.4.96.6 Watches | Northeastern Fine Jewelry"
941,0, Monin Roasted Chestnut Syrup Monin Syrup",Daniel Wellington Classic Lady Sheffield rose gold@nl-NL gold 10:35 Horloge boektiek"@nl-NL
942,0,Chopard Happy Sport Mini Watch 278509-6003 278509-6003 | Dejaun Jewelers",Bvlgari Bvlgari Soltempo Watch BB39WSPGD BB41C3SLD | Dejaun Jewelers"
943,1,Raymond Weil Tango Watch 5391-STP-00995 "Shop Raymond 5960-ST-00995 Watches | Costello Jewelry Company",Raymond Weil Tango Watch 5391-STP-00995 "Shop Raymond 5391-ST-00995 Watches | Costello Jewelry Company"
944,0, Monitor Polar A360 - S Blanco @es "Monitor Alkomprar.com"@es,Unisex V800 Bluetooth Heart Rate Monitor GPS Smart Alarm Chronograph Watch @de "Fitness Uhren"@de
945,1, 88 Rue Du Rhone Men's Chronograph Watch@en "Men's Watch (87WA164501) - WATCH SHOP.com?"@en,Herren 88 Rue Du Rhone Chronograf Uhr 87WA164501@de
946,0,Daniel Wellington Classic Man Black Sheffield silver@nl-NL silver 10:35 Horloge boektiek"@nl-NL,Sheffield Silver Reloj para hombre 40mm@es 00 €"@es "Daniel Wellington Sheffield 40mm nur 149
947,0,Omega Speedmaster Watch 311.92.44.51.01.005 "Speedmaster",Omega Co-Axial Chronograph 44.25?mm@en-GB
948,1,Damenuhr@de "Citizen Damenuhr FE1081-08A nur 99 00 €"@de,Reloj para mujer@es "Citizen Reloj mujer FE1081-08A nur 99 00 €"@es
949,0,Herren Hamilton Jazzmaster Thinline 40mm Uhr H38411783@de,JAZZMASTER AUTO CHRONO@es "reloj hamilton"@es
950,0,Raymond Weil Noemia Watch 5132-STP-00985 "Shop Raymond 5132-ST-80081 Watches | Costello Jewelry Company", Ladies Raymond Weil Noemia 32mm Diamond Watch 5132-STS-00985 Ladies Watches | Designer For Women The Hut"
951,1,Bvlgari Tubogas Watch SP35BDSDS.2T SP35C6SPG.2T | Dejaun Jewelers",Bvlgari Tubogas Watch SP35BDSDS.2T SPP35BGDG.2T | Dejaun Jewelers"
952,0,Carl F Bucherer ScubaTec Watch 00.10632.23.53.01 "Shop Carl 00.10632.24.33.21 | Moyer Fine Jewelers",Carl F Bucherer Peripheral Watch 00.10917.08.73.11 "Shop Carl 00.10917.08.73.11 Watches | Costello Jewelry Company"
953,0,Cronografo T-Sport PRC200 Quartz Gent@it "Tissot Cronografo Gent T055.417.11.037.00 - Colombo Gioielleria"@it,Tissot T Classic Couturier @en
954,0,Cartier Hypnose Watch WJHY0005 "Shop Cartier WJHY0003 Watches | Northeastern Fine Jewelry",Cartier Tank Fran?aise Watch W51008Q3 "Shop Cartier W4TA0009 Watches | Northeastern Fine Jewelry"
955,1,Black Manifesto Power Watch@default "Versace Black Watch for Women | Official Website"@default,Orologio Manifesto Power nero@it nero - Versace Donna | Shop Online Italia"@it
956,0,Casio Unisex Digital Bracelet Watch A500WEA-1EF, Unisex Casio Classic Collection Alarm Chronograph Watch LA670WEGB-1BEF Mens Sale Watches"
957,0,Casio EF-121D-1AVEF@bg EF-121D-1AVEF | Edifice Stotak.com"@bg,Edifice Herrenchronograph@de "Casio Edifice Herrenchronograph EF-539D-1A2VEF nur 125 00 €"@de
958,1,G-Shock Reloj para hombre@es "Casio G-Shock hombre GA-100CF-1A9ER nur 129 00 €"@es,Mens g-schok zwarte chronograaf horloge
959,0,Dior Chiffre Rouge Watch CD084B40R001 CD084C10A001 | Dejaun Jewelers",Bvlgari Bvlgari Watch BBL33WSPGD BBL33WSL 12 | Dejaun Jewelers"
960,0,Jazzmaster Maestro Small Second Automatic Watch@en 145.00"@en "Hamilton Jazzmaster Watch nur € 1,JAZZMASTER AUTO CHRONO@es "reloj hamilton"@es
961,0,Fitbit Charge 2 Heart Rate Fitness Watch - No wristband just watch@en watch GPS & Running Watches"@en,TomTom Runner 2 Music BLK/ANT (Large) Horloge - Zwart/Anthracite@nl " TomTom Hardloop Accessoires Zwart-Anthracite "@nl
962,0,Quickster Chronograf m?ski@pl 00 €"@pl "Tissot Quickster m?ski T095.417.17.037.01 nur 375,Damenchronograph PRC200@de "Tissot Damenchronograph PRC200 T055.217.16.032.02 nur 430 00 €"@de
963,0,Serein Mid Two-Tone  Diamond Dial Watch Mid",Michele Deco Mid  Teal Diamond Dial Watch MW06V00A0029 MS16DM235009 "Deco Mid"
964,1,Chopard Chronograph Watch 388549-3002 388549-3001 | Dejaun Jewelers",Chopard Chronograph Watch 388549-3002 388549-3002 | Dejaun Jewelers"
965,1,Carl F Bucherer AutoDate Watch 00.10915.08.13.21 "Shop Carl 00.10915.03.13.01 | Moyer Fine Jewelers",Carl F Bucherer AutoDate Watch 00.10915.08.13.21 "Shop Carl 00.10915.03.13.01 Watches | Costello Jewelry Company"
966,0,Check Web Prices  "Clothing Clothing Accessories Watches"  "Casio GA201-1A G-Shock Alarm" Alarm Watches price comparison",G-Shock Herrenuhr@de "Casio G-Shock Herrenuhr GA-400-1BER nur 129 00 €"@de
967,1,Cartier Tank Louis Cartier Watch W1529756 "Shop W1529756 Watches | Northeastern Fine Jewelry",Cartier Tank Series Mens Watch W1529756@en-us
968,0,Tissot Quickster T095.417.17.037.01 Chrono@es "Reloj Tissot T-Sport catálogo oficial Laguardajoiers distribuidor de en Barcelona"@es,Tissot T048.417.27.057.06 T-Race@es "Reloj Tissot T-Sport T-Race Laguardajoiers agente oficial de en Barcelona"@es catálogo
969,1,Diver Automatic Divers′ Watch@en "Seiko Diver Watch SKX007K2 nur € 299.00"@en,Diver Automatyczny Zegarek do nurkowania@pl 00 €"@pl "Seiko Diver nurkowania SKX007K2 nur 299
970,1,Omega Seamaster 25318000 " Discover the Omega watch collection at Albemarle Bond,Omega Seamaster 300m 2531.80.00 2531.80.00 Watch | Watchfinder & Co."
971,0,Cartier Ronde Louis Cartier Watch W6800151 "Shop W6800151 Watches | Northeastern Fine Jewelry",Cartier Santos 100 Watch W20106X8 "Shop Cartier W20106X8 Watches | Northeastern Fine Jewelry"
972,1,Michele Deco Madison Watch MW06T00A0101_MS18AA030402 "Shop Michele MW06T00C9018_MS18AU285048 Watches | Northeastern Fine Jewelry",Michele Deco Madison Watch MW06T00A0101_MS18AA030402 "Shop Michele MW06T01A1113_MS18AU235009 Watches | Costello Jewelry Company"
973,0, NIXON THE K SQUARED GOLD... @fr-fr  VINTAGE WATCH GOLD WOVEN STRAP OLIVIA BURTON MINI ANTIQUES... KENSINGTON... WILSON MICHAEL JORDAN NINTENDO SUPER... ROSE... TIME TELLER... WEWOOD CRISS ARABESQUE BEIGE ANTEA BLUEBERRY JUPITER BLACK BIG DIAL GREY... TIMEX EXPEDITION SCOUT... KOMONO ESTELLE LIME FLOWER SMALL CORN WATERBURY X RED WING... KENSINGTON ALL KAPPA ROSE SILVER... PASSION AUTOMATIC ORIENT... "OLIVIA MIDI AND GOLD"@fr-fr  NUT MINT LOTUS "@fr-fr - Chez maman"@fr-fr,Sheffield Rosegold Herrenuhr 40mm@de "Daniel Wellington Sheffield 40mm nur 189 00 €"@de
974,0,Cartier Santos W20099C4 W20099C4 Watch | Watchfinder & Co.",Cartier Santos W20011C4 W20011C4 Watch | Watchfinder & Co."
975,0,Tissot PRS200 PRS 200 Stainless Steel Chronograph Men's Watch T0674171103101 " Tissot T0674171103101 | watchtag.com",Mens PRC200 Chronograph Watch @de "Luxusuhren vieler Qualit?tsmarken online | DE Shop?"@de
976,0,Cartier "CartierCartier Roadster Series Men's Watch W62020 x 6",Cartier Santos 100 W20090X8 W20090X8 Watch | Watchfinder & Co."
977,1,Parade Lyria Leaves Necklace P2771-R2-WRFS2 "Shop Parade N2120-O1-FS Necklaces | Mitchum Jewelers",Parade Lyria Leaves Necklace P2771-R2-WRFS2 "Shop Parade P3281 R1 Necklaces | Mitchum Jewelers"
978,0,Herren Hamilton Jazzmaster Thinline Uhr H38511133@de,Hamilton Jazzmaster Viewmatic Skeleton Gent Auto Watch H42545551
979,0,Cartier Drive De Cartier Watch WGNM0006 "Shop WSNM0005 Watches | Northeastern Fine Jewelry",Cartier Tortue Watch WA501012 "Shop Cartier WGTO0003 Watches | Northeastern Fine Jewelry"
980,1,Hamilton Jazzmaster Seaview Day Date Quartz Watch H37511131,Jazzmaster Seaview Day Date Herrenuhr@de "Hamilton Jazzmaster Herrenuhr nur 590 00 €"@de
981,0,Michele Deco Mid Diamond Watch "Dynamic Filter",Michele Deco Mid MWW06V000004 "MWW06V000004 | Michele AuthenticWatches.com"
982,1, Ladies Sekonda Editions Watch 2463 Latest Mens Watches", Ladies Sekonda Editions Watch 2463 Sale | The Hut"
983,0,Cartier Ronde Solo De Cartier Watch W6701009 "Shop W6701008 Watches | Northeastern Fine Jewelry",Cartier Tank MC Watch W5330007 "Shop Cartier WGTA0014 Watches | Northeastern Fine Jewelry"
984,1, Ladies Karl Lagerfeld Joleigh Watch KL3409 Latest Mens Watches", Ladies Karl Lagerfeld Joleigh Watch KL3409 New arrivals | Shop New The Hut"
985,1,Meister Driver Chronoscope Automatikuhr@de "Junghans Meister Automatikuhr nur 1.990 00 €"@de,Meister Driver Chronoscope Reloj automático@es "Junghans Meister automático nur 1.990 00 €"@es
986,0,Herren Casio G-Shock Wecker Chronograf Uhr AW-590-1AER@de,Mens G-Shock Alarm Chronograph Watch @de "Oversized Uhren online bestellen | DE Shop?"@de
987,0, Raymond Weil Men's Tradition Watch@en "Men's Watch (5466-ST-00608) - WATCH SHOP.com?"@en,Raymond Weil Noemia Watch 5132-STP-00985 "Shop Raymond 5132-STS-65081 Watches | Costello Jewelry Company"
988,0,Cartier Santos-Dumont Watch WH100351 "Shop Cartier W2009251 Watches | Northeastern Fine Jewelry",Cartier Santos W20012C4 W20012C4 Watch | Watchfinder & Co."
989,0,SKINGALA@en " Watches - Swatch? United Arab Emirates"@en,Cartier Tank Solo Watch W5200025 "Shop Cartier W5200026 Watches | Northeastern Fine Jewelry"
990,0,Seiko Automatik SKX007 / SKX007K2 Scuba Diver's Taucheruhr@de,Seiko SKX007K1 watch
991,0,Daniel Wellington Classic Lady Black Bristol rose gold@en-GB gold 10:35 Watch boutique"@en-GB, DAN?EL WELL?NGTON DW00100143 Kol Saati @tr "Daniel Wellington En Ucuz Fiyat"@tr
992,0,Carl F Bucherer AutoDate TwoTone Watch 00.10621.07.77.21 "Shop Carl 00.10621.07.77.21 Watches | Costello Jewelry Company",Carl F Bucherer AutoDate Watch 00.10915.08.13.21 "Shop Carl 00.10915.08.13.21 | Moyer Fine Jewelers"
993,0,Damen Raymond Weil Noemia 32mm Diamant Uhr 5132-STS-00985@de,Raymond Weil Toccata Watch 5388-PC5-65001 "Shop Raymond 5388-ST-50081 Watches | Costello Jewelry Company"
994,0,Seiko SRP777K1 Prospex Mar Diver's@es "Reloj Seiko Automático,Seiko Automatik SKX007 / SKX007K2 Scuba Diver's Taucheruhr@de
995,0,Dapper Sheffield Rose Gold 38mm@en "Daniel Wellington Dapper 38mm nur € 179.00"@en,York Ró?owe z?oto Zegarek m?ski 40mm@pl 00 €"@pl "Daniel Wellington York 40mm nur 139
996,0,Bvlgari Bvlgari Watch BBL26WSSD BBL33WSS 12 | Dejaun Jewelers",Bvlgari B.Zero1 Watch BZ23WSGDL 12 BZ23BSGCC 12.M | Dejaun Jewelers"
