id,label,left_title,right_title
1286,0,Raymond Weil Toccata Watch 5488-STC-50001 "Shop Raymond 5488-SL5-65001 Watches | Costello Jewelry Company",Damen Raymond Weil Toccata Diamant Uhr 5388-ST-50081@de
1287,0,Damen Michael Kors Parker Chronograf Uhr MK5626@de, Pulsar Men's Chronograph Solar Powered Watch@en "Men's Watch (PX5019X1) - WATCH SHOP.com?"@en
1288,1,Michele Deco Watch MWW06P000014 "Shop Michele MWW06P000100 Watches | Costello Jewelry Company",Michele Deco Watch MWW06P000014 "Shop Michele MWW06P000234 Watches | Northeastern Fine Jewelry"
1289,0,Jazzmaster Seaview Day Date Automatikuhr@de "Hamilton Jazzmaster Automatikuhr nur 830 00 €"@de,Herren Hamilton Jazzmaster Seaview Chronograf Uhr H37512731@de
1290,0,Hamilton AC Jazzmaster Lady Auto@es Auto - Tomas Colomer"@es,Hamilton Seaview Day Date Auto H37565131 "Seaview Auto"
1291,1,Bvlgari LVCEA Watch LU28C6SSD LU28C6SSD | Dejaun Jewelers",Bvlgari LVCEA Watch LU28C6SSD LU28C6SSPGD | Dejaun Jewelers"
1292,1,Carl F Bucherer Flyback Watch 00.10919.08.13.01 "Shop Carl 00.10919.03.43.01 Watches | Costello Jewelry Company",Carl F Bucherer Flyback Watch 00.10919.08.13.01 "Shop Carl 00.10919.08.13.01 Watches | Costello Jewelry Company"
1293,1, Certina Ladies' DS-1 Automatic Watch@en "Ladies' Watch (C0062071103100) - WATCH SHOP.com?"@en, Ladies Certina DS-1 Automatic Watch C0062071103100 Ladies Watches | Designer For Women The Hut"
1294,1,Longines Conquest Watch L3.700.4.96.6 "Shop Longines L3.700.4.56.6 Watches | Northeastern Fine Jewelry",Longines Conquest Watch L3.700.4.96.6 "Shop Longines L3.687.4.76.6 Watches | Northeastern Fine Jewelry"
1295,0,Tissot T Sport PRC 200 @en,Orologio T-Classic Le Locle Automatic Gent@it "Tissot Orologio Gent T41.1.483.53 - Colombo Gioielleria"@it
1296,0,SUUNTO AMBIT 3 PEAK BLACK HR@de HR - TREKKING GPS Suunto Farbe Schwarz SS020674000 Der Online-Shop für deine Sportbekleidung"@de,Garmin Forerunner 235 - Black Frost Blue@en " Garmin Running Accessories & Blue "@en
1297,0,Carhartt - Casquette Acrylique Gris@fr "Salopettes Online Fran?ais | Carhartt,Hamilton Jazzmaster Lady Quartz Watch H42211155 H32341975"
1298,0,Michele Deco Mid Watch MWW06V000003 "Shop Michele MW06V00A0029_MS16DM235009 Watches | Costello Jewelry Company",Michele Deco Mid Watch MWW06V000004 "Shop Michele MWW06V000003 Watches | Northeastern Fine Jewelry"
1299,1,Max Bill Damenuhr@de "Junghans Max Damenuhr 047/4541.00 nur 495 00 €"@de,Max Bill Ladies′ Watch@en "Junghans Max Watch 047/4541.00 nur € 495.00"@en
1300,1, Mens Tissot PRS516 Chronograph Watch T1004171604100 New arrivals | Shop New The Hut",NEC Slot-In PC 100013751 2.2GHz 2000E 900g Negro cliente liviano@es "HP ProDisplay P203 20" HD+ TN pantalla para - Black Friday... "@es
1301,1,Chopard Superfast Watch 161291-5001 168523-3001 | Dejaun Jewelers",Chopard Superfast Watch 161291-5001 168542-3001 | Dejaun Jewelers"
1302,0,Classic Black Cornwall Rosegold 40mm@de "Daniel Wellington Classic 40mm nur 159 00 €"@de,Daniel Wellington Classic Lady Black Sheffield rose gold@nl-NL gold | 10:35 Horloge boetiek"@nl-NL
1303,1,G-Shock Style Radiocontrol-Reloj solar@es "Casio G-Shock solar nur 279 00 €"@es,Jockey Women's Tops No Panty Line Promise Tactel Lace Chemise  light  XL@en-US "Women's Clothing - Page 241 | Mas Fashion"@en-US
1304,0,Carl F Bucherer T-Graph Watch 00.10615.08.33.21 "Shop Carl 00.10615.08.13.21 | Moyer Fine Jewelers",Carl F Bucherer ChronoDate Watch 00.10624.08.53.01 "Shop Carl 00.10624.08.13.01 Watches | Costello Jewelry Company"
1305,1,Herren Raymond Weil Toccata Uhr 5488-STC-50001@de,Raymond Weil Toccata Watch 5488-STC-50001 "Shop Raymond 5588-STC-20001 Watches | Costello Jewelry Company"
1306,0,Daniel Wellington Classic Man Sheffield silver@nl-NL silver | 10:35 Horloge boetiek"@nl-NL, DANIEL WELLINGTON Men's Sheffield 40mm Watch @en "DANIEL DW00100007 ￡89.00 - TheWatchSuperstore.com?"@en
1307,0,Daniel Wellington Classic Lady Bristol rose gold@nl-NL gold | 10:35 Horloge boetiek"@nl-NL,Daniel Wellington Classic Man Glasgow rose gold@nl-NL gold 10:35 Horloge boektiek"@nl-NL
1308,1,Orchard Gem Watch@en "RumbaTime Orchard Watch | SHOPBOP"@en,Orchard Gem Watch@en "RumbaTime Orchard Watch | SHOPBOP SAVE UP TO 30% Use Code: MORE17"@en
1309,0,Seiko SRP777K1 Prospex Mar Diver's@es "Reloj Seiko Automático,Hombre-Reloj automático@es "Seiko Hombre-Reloj automático SRP705K1 nur 279 00 €"@es
1310,0,Panerai Radiomir 10 Days GMT PAM00323 PAM00323 Watch | Watchfinder & Co.",Panerai 2013 Watch PAM00446 "Shop Panerai PAM00532 Watches | Northeastern Fine Jewelry"
1311,0,Michele Deco Mid  Diamond Dial Watch "Dynamic Filter",Michele Deco Mid Watch MWW06V000001 "Shop Michele MWW06V000003 Watches | Northeastern Fine Jewelry"
1312,0,The Crew Leather Dorado / Cream Black@es "Nixon The Black nur 159 00 €"@es,Damen Nixon The Kensington Leder Uhr A108-1045@de
1313,0,Bvlgari B.Zero1 Watch BZ23WSGCL 12 BZ23BSGCC 12.M | Dejaun Jewelers",Bvlgari B.Zero1 Watch BZ23WSGDL 12 BZ23WSCC.M | Dejaun Jewelers"
1314,0,Max Bill Zegarek damski@pl 00 €"@pl "Junghans Max damski 047/4541.00 nur 495,Automatikuhr Max Bill@de "Junghans Automatikuhr Bill 027/4701.00 nur 925 00 €"@de
1315,1,Herren Emporio Armani Chronograf Uhr AR1737@de,Mens Chronograph Watch @de "Fathers Tag - Uhren und gift ideas"@de
1316,0,Michele Deco Mid Gold  Diamond Dial Watch "Deco Mid",Michele Deco Mid Watch MW06V00A0029_MS16DM235009 "Shop Michele MWW06V000023 Watches | Costello Jewelry Company"
1317,1,Longines Conquest Watch L3.277.4.76.6 "Shop Longines L3.700.4.56.6 Watches | Northeastern Fine Jewelry",Longines Conquest Watch L3.277.4.76.6 "Shop Longines L3.277.4.76.6 Watches | Northeastern Fine Jewelry"
1318,0,Cartier  "CartierCartier Roadster Series Men's Watch W62041V3",Cartier "CartierCartier Must 21 Series Men's Watch W10125U2"
1319,1,Cantilever Scope Rings - Cantilever Ring 30mm Offset Absolute Co-Witness@en-us, Mens Skagen Holst Watch SKW6285 Sale | The Hut"
1320,0,Chronograf m?ski PRS200@pl 00 €"@pl "Tissot Chronograf PRS200 T067.417.22.031.01 nur 560,Herren Casio G-Shock Wecker Chronograf Uhr GA-400-1BER@de
1321,1,Cartier  "CartierCartier Classic Santos Series Men's Watch W20098D6",Cartier W20098D6 Santos Galbee Extra Large Watch@en Watches From SwissLuxury"@en
1322,1, Ladies Accurist Watch LB1791 Sale | The Hut", Ladies Accurist Watch LB1791 Ladies Sale Watches"
1323,0,Mens Ambit 3 Peak Bluetooth GPS Chronograph Watch @de "Herren Gadget Uhren"@de, Suunto Men's Ambit 3 Peak HR Bluetooth GPS Chronograph Watch@en "Men's Watch (SS020674000) - WATCH SHOP.com?"@en
1324,0,Michele Serein Mid Watch MW21B01D2963_MS16DH315750 "Shop Michele MW21B00A0106_MS16DH235009 Watches | Northeastern Fine Jewelry",Michele Deco Mid Watch MW06V00A0029_MS16DM235009 "Shop Michele MWW06V000001 Watches | Costello Jewelry Company"
1325,0, Casio Men's Edifice Time Traveller Bluetooth Hybrid Smartwatch Alarm Chronograph Watch@en "Men's Watch (EQB-500DB-2AER) - WATCH SHOP.com?"@en,G-Shock Men′s Watch@en "Casio G-Shock Watch GA-800-1AER nur € 129.00"@en
1326,1,Cartier Tank MC Watch W5330007 "Shop Cartier W5330005 Watches | Northeastern Fine Jewelry",Cartier Tank MC Watch W5330007 "Shop Cartier WSTA0010 Watches | Northeastern Fine Jewelry"
1327,1,Raymond Weil Toccata Watch 5388-PC5-65001 "Shop Raymond 5488-ST-00300 Watches | Costello Jewelry Company",Raymond Weil Toccata Watch 5388-PC5-65001 "Shop Raymond 5388-PC5-65001 Watches | Costello Jewelry Company"
1328,0,Rolex Milgauss 116400 GV GV Watch | Watchfinder & Co.",Cartier Roadster W62004V3 W62004V3 Watch | Watchfinder & Co."
1329,0,Bvlgari B.Zero1 Watch BZ23WSGCL 12 BZ23WSGS 12.M | Dejaun Jewelers",Bvlgari LVCEA Watch LU33C6SSPGD LU33C6SSD | Dejaun Jewelers"
1330,0,Montre Tissot T-TOUCH EXPERT SOLAR / Acier Rouge@fr,Quickster Chronograf m?ski@pl 00 €"@pl "Tissot Quickster m?ski T095.417.17.037.01 nur 375
1331,0,JAZZMASTER AUTO CHRONO@es CHRONO - Tomas Colomer"@es,JAZZMASTER SLIM AUTO@es AUTO - Tomas Colomer"@es
1332,0,Mens Watch @de "Marea Uhren online bestellen | DE Shop?"@de, GUCC? YA1264018 Bayan Kol Saati @tr "Gucci En Ucuz Fiyat"@tr
1333,1,Maurice Lacroix Les Classiques Watch LC1087-SS002-121-1 "Shop Maurice LC6063-PS103-310 Watches | Costello Jewelry Company",Maurice Lacroix Les Classiques Watch LC1087-SS002-121-1 "Shop Maurice LC1087-SS001-120-1 Watches | Costello Jewelry Company"
1334,0,Pontos S Herrenchronograph Automatik@de "Maurice Lacroix Pontos Automatik nur 3.990 00 €"@de,Mens Aikon Chronograph Watch @de "Maurice Lacroix Schweizer hergestellt luxuri?s Uhren - including Pontos Miros Fiaba und Les Classique ranges"@de
1335,0,Core All Black "Suunto Core Black - Relojes de Monta?a Electrónica y Orientación en Barrabes.com", Unisex Suunto Spartan Wrist HR Barometer Bluetooth Chronograph Watch SS050000000 Men's Watches | Designer For Men The Hut"
1336,1,Mr. Daddy 2.0 Reloj para hombre@es "Diesel Mr. hombre DZ7350 nur 349 00 €"@es,Mr. Daddy 2.0 Zegarek m?ski@pl 00 €"@pl "Diesel Mr. m?ski DZ7350 nur 349
1337,0,Carl F Bucherer Power Reserve Watch 00.10912.08.33.21 "Shop Carl 00.10912.08.33.21 Watches | Costello Jewelry Company",Carl F Bucherer TravelTec Watch 00.10620.08.53.01 "Shop Carl 00.10620.03.33.01 | Moyer Fine Jewelers"
1338,0,Cartier Hypnose Watch WJHY0006 "Shop Cartier WJHY0003 Watches | Northeastern Fine Jewelry",Cartier Tank Fran?aise Watch W4TA0009 "Shop Cartier WE110004 Watches | Northeastern Fine Jewelry"
1339,0,Ladies Day Dream Watch @de "Folli Follie Uhren und Schmuck | Official FOLLI FOLLIE Stockist"@de,Freja Zegarek damski@pl 00 €"@pl "Skagen Freja damski 358SSSD nur 119
1340,0,Solar Men′s Chronograph@en "Seiko Solar Chronograph SSC437P1 nur € 239.00"@en,Seiko Flightmaster Solar Chronograph 100m Leather Pilots Watch SSC009P3 @en | Dutyfreeislandshop.com"@en
1341,1,Cartier Roadster W62025V3 "W62025V3 | Cartier AuthenticWatches.com",Cartier Roadster W62025V3 W62025V3 Watch | Watchfinder & Co."
1342,1,Montre Palazzo Empire rouge@fr rouge - Versace Femme | Boutique en Ligne EU"@fr,Palazzo Empire Uhr Rot@de "Versace Palazzo Rot für Damen | Online Store EU"@de
1343,0,Joma Champion III LS Jersey - White/Royal@en " Joma Mens Football Teamwear White/Royal "@en, Mens Marea Watch 54088/3 Brands"
1344,1, ZIIIRO MERCURY CHROME OCEAN @fr-fr  TOKYOFLASH KISAI SPIDER... "CASIO A500WEA-1EF WORLD TIME SILVER"@fr-fr  CELESTE COLORED SATURN MR JONES CYCLOPS SUMMER NIGHT BLADE DARK... ECLIPSE ROSE GOLD SUN AND MOON COUNT DOWN CLOCK BLACK NIGHT... ROSEGOLD PURPLE GUNMETAL MINT MONO MARU... DAWN WEST DUSK LEMON THE LAST LAUGH /... SPACE... SATELLITE ADJUST... TRAVELLER LAUGH... ALL GOLD... AVERAGE DAYS GUNMETAL... "@fr-fr SILVER - Chez maman"@fr-fr,Casio Unisex Digital Bracelet Watch A500WEA-1EF
1345,1,Bvlgari Bvlgari Soltempo Watch BB39WSPGD BB39WSSD | Dejaun Jewelers",Bvlgari Bvlgari Soltempo Watch BB39WSPGD BB41BSLD | Dejaun Jewelers"
1346,1,Damen Raymond Weil Tango Diamant Uhr 5391-ST-00995@de,Raymond Weil Tango Watch 5391-ST-00995 "Shop Raymond 5391-ST-00995 Watches | Costello Jewelry Company"
1347,0,Omega Master Co-Axial 41?mm@en-GB,Omega Seamaster 22545000 " Discover the Omega watch collection at Albemarle Bond
1348,0,Georgia Damenuhr@de "Fossil Georgia Damenuhr ES3745 nur 129 00 €"@de, Tissot Men's Desire Watch@en "Men's Watch (T52142112) - WATCH SHOP.com?"@en
1349,0,Zegarek automatyczny Jazzmaster Traveler 2 GMT@pl 00 €"@pl "Hamilton Zegarek GMT nur 895,Jazzmaster Lady Automatic Ladies′ Watch@en "Hamilton Jazzmaster Watch nur € 895.00"@en
1350,0, Mens Casio G-Shock Alarm Chronograph Watch GA-800-1AER Sale | The Hut",G-Shock Mudmaster Men′s Watch@en "Casio G-Shock Watch GWG-1000GB-1AER nur € 749.00"@en
1351,0, Hamilton Men's Jazzmaster Maestro Automatic Chronograph Watch@en "Men's Watch (H32766513) - WATCH SHOP.com?"@en,Hamilton AC Jazzmaster Regulator Auto@es Auto - Tomas Colomer"@es
1352,0,Cartier Santos 100 Watch W20073X8 "Shop Cartier W20073X8 Watches | Northeastern Fine Jewelry",Cartier Santos 100 Watch W20106X8 "Shop Cartier W20072X7 Watches | Northeastern Fine Jewelry"
1353,0,Seiko Automatik SKX007 / SKX007K2 Scuba Diver's Taucheruhr@de,Automático Diver′s Reloj para hombre@es "Seiko Automático hombre SRP639K1 nur 395 00 €"@es
1354,0,Cartier Santos 100 Watch W20126X8 "Shop Cartier W20126X8 Watches | Northeastern Fine Jewelry",Cartier Santos 100 Watch W20106X8 "Shop Cartier W20072X7 Watches | Northeastern Fine Jewelry"
1355,0,Tissot PRC 200 Automatic T055.430.11.057.00 Powermatic 80@es catálogo oficial Laguardajoiers distribuidor de Tissot en Barcelona"@es "Reloj T-Sport 80,Tissot Couturier Quartz T035.439.11.051.00 GMT Gent@es catálogo oficial Laguardajoiers distribuidor de Tissot en Barcelona"@es "Reloj Gent
1356,0,Mens Visodate Automatic Watch @de "Tissot T-klassisch Uhren | Official TISSOT Stockist"@de,Tissot Classic Dream@en T Dream T033.210.22.111.00 Women's Watch - The Prime Watches."@en
1357,0,Cartier Ronde Louis Cartier Watch WR000251 "Shop WR000551 Watches | Northeastern Fine Jewelry",Cartier Ronde Louis Cartier Watch W6800151 "Shop WR000551 Watches | Northeastern Fine Jewelry"
1358,0,Astron GPS S?oneczna energia Dual Time@pl 00 €"@pl "Seiko Astron Time nur 1.955,Solar Men′s Chronograph@en "Seiko Solar Chronograph SSC431P1 nur € 329.00"@en
1359,0,Diesel 'mr. Daddy 2.0' Chronograph Watch @en " Men's Metallic Diesel 'little Daddy' Bracelet, GC Ladies Lady Chic Chronograph Watch @en "GC Y05010M1 ￡219.00 - TheWatchSuperstore.com?"@en
1360,0,Chopard Grand Prix De Monaco Watch 158569-3001 168569-9001 | Dejaun Jewelers",Chopard Grand Prix De Monaco Watch 168570-9001 161275-5003 | Dejaun Jewelers"
1361,0,Hamilton AC Jazzmaster Regulator Auto@es Auto - Tomas Colomer"@es, Hamilton Ladies' Jazzmaster Lady 30mm Watch@en "Ladies' Watch (H42211155) - WATCH SHOP.com?"@en
1362,0,Tortoise Watch@en "Michael Kors Tortoise Watch | SHOPBOP SAVE UP TO 30% Use Code: MORE17"@en,Blair Watch@en "Michael Kors Blair Watch | SHOPBOP SAVE UP TO 30% Use Code: MORE17"@en
1363,0,Classic Black St Mawes Oro Rosé 36mm@es "Daniel Wellington Classic 36mm nur 169 00 €"@es,Unisex Daniel Wellington klassisch Schwarz Bristol Uhr 36mm DW00100137@de
1364,0,Raymond Weil Toccata Watch 5488-ST-50001 "Shop Raymond 5588-ST-20001 Watches | Costello Jewelry Company",Raymond Weil Maestro Watch 2238-ST-00659 "Shop Raymond 2227-ST-00659 Watches | Costello Jewelry Company"
1365,0,Daniel Wellington Classic Lady Black Reading silver@en-GB silver 10:35 Watch boutique"@en-GB, DAN?EL WELL?NGTON DW00100143 Kol Saati @tr "Daniel Wellington En Ucuz Fiyat"@tr
1366,1,Chopard Happy Sport Chrono Watch 288499-3001 288499-3008 | Dejaun Jewelers",Chopard Happy Sport Chrono Watch 288499-3001 288499-3016 | Dejaun Jewelers"
1367,1, Mens Raymond Weil Tango Watch 5591-ST-00607 Mens Watches",Raymond Weil Tango Watch 5591-ST-00607 "Shop Raymond 5591-ST-20001 Watches | Costello Jewelry Company"
1368,0,PT6388-SS001-430-1 - Maurice Lacroix Pontos Chronograph@en Watch Chrono. Watches in barcelona catalog with prices."@en,Mens PRS200 Chronograph Watch @de "Luxusuhren vieler Qualit?tsmarken online | DE Shop?"@de
1369,0,G-Shock Herrenuhr@de "Casio G-Shock Herrenuhr GA-800-1AER nur 129 00 €"@de,G-Shock Reloj para hombre@es "Casio G-Shock hombre GA-110MB-1AER nur 129 00 €"@es
1370,0,Bvlgari LVCEA Watch LU28C6SSD LU33WSSD 11 | Dejaun Jewelers",Bvlgari B.Zero1 Watch BZ23WSGDL 12 BZ23BSCL | Dejaun Jewelers"
1371,0,Air Jordan 9 Retro “Slim Jenkins” For Sale@en-US Sale – Hoop Jordan"@en-US,Air Jordan 5 Retro White/Black-Fire Red@en-US Red | Cheap Jordans 2018"@en-US
1372,0,Longines Conquest Watch L3.277.4.76.6 "Shop Longines L3.277.4.76.6 Watches | Northeastern Fine Jewelry",Cartier Santos 100 Watch W20106X8 "Shop Cartier WSSA0006 Watches | Northeastern Fine Jewelry"
1373,0,Polar Loop 2 Zwart (Zwart) - Prijzen @NL Tweakers"@NL,TomTom Runner 2 Music BLK/ANT (Large) Horloge - Zwart/Anthracite@nl " TomTom Hardloop Accessoires Zwart-Anthracite "@nl
1374,0,Cartier  "CartierCartier Tank Series Men's Watch W1529756",Cartier Tank Solo @en
1375,0,Alpina Startimer Pilot Automatic Watch AL-525G4TS6 "Shop Alpina AL-525G4TS6 | Moyer Fine Jewelers",Alpina Automatic 4 Watch AL-525BS5AQ6 "Shop Alpina AL-525NS5AQ6B | Moyer Fine Jewelers"
1376,1,Glasgow Silver Zegarek damski 36mm@pl 20 €"@pl "Daniel Wellington Glasgow 36mm nur 111,Herren Daniel Wellington Glasgow Silber 36mm Uhr DW00100047@de
1377,0,PYLE - Sports Watch Silver@en-US,Cartier "CartierCartier Classic Santos Series Men's Watch W20011C4"
1378,1,Edifice Herrenuhr Solar Bluetooth@de "Casio Edifice Bluetooth EQB-500DB-2AER nur 329 00 €"@de,Edifice Men′s Watch Solar Bluetooth@en "Casio Edifice Bluetooth nur € 329.00"@en
1379,0,Raymond Weil Maestro Watch 2238-ST-00659 "Shop Raymond 2227-ST-00659 Watches | Costello Jewelry Company",Raymond Weil Tango Watch 5591-ST-00607 "Shop Raymond 8160-ST-00608 Watches | Costello Jewelry Company"
1380,0,Omega Speedmaster 311.92.44.51.01.003,Omega Co-Axial Chronograph 44.25?mm@en-GB
1381,1, Interchangeable bracelet Two-tone 8 diamonds @en-US "Shine - Gold Steel Diamond White Pearl Satin Watch Raymond Weil"@en-US, Raymond Weil Ladies' Shine Watch@en "Ladies' Watch (1600-STP-00995) - WATCH SHOP.com?"@en
1382,0,Mens Maestro Beatles Limited Edition Automatic Watch @de "Luxusuhren vieler Qualit?tsmarken online | DE Shop?"@de,Raymond Weil Maestro Watch 2238-ST-00659 "Shop Raymond 2227-STC-00659 Watches | Costello Jewelry Company"
1383,1,Daniel Wellington Classic Lady Reading rose gold@nl-NL gold | 10:35 Horloge boetiek"@nl-NL,Reading Ró?owe z?oto Zegarek damski 36mm@pl 00 €"@pl "Daniel Wellington Reading 36mm nur 169
1384,0,Glasgow Rosegold Herrenuhr 40mm@de "Daniel Wellington Glasgow 40mm nur 119 00 €"@de,York Rosegold Herrenuhr 40mm@de 00 €"@de "Daniel Wellington York 40mm nur 139
1385,1,Herren Tissot T-Touch II Titan Wecker Chronograf Uhr T0474204720701@de,TissotTissot Swiss Made Wrist Watch T047.420.47.207.01 44mm  "Tissot"
1386,0, Mens 88 Rue Du Rhone Chronograph Watch 87WA164501 Sale | The Hut", Unisex Suunto Spartan Wrist HR Barometer Bluetooth Chronograph Watch SS050000000 Men's Watches | Designer For Men The Hut"
1387,0,Raymond Weil Freelancer Watch 7740-SC1-65221 "Shop Raymond 2754-SR-05200 Watches | Costello Jewelry Company",Raymond Weil Maestro Watch 2237-ST-20001 "Shop Raymond 2237-ST-20001 Watches | Costello Jewelry Company"
1388,0, Tissot Men's T-Touch Expert Titanium Alarm Chronograph Watch@en "Men's Watch (T0134204720200) - WATCH SHOP.com?"@en,JAZZMASTER AUTO CHRONO@es "reloj hamilton"@es
1389,0,Raymond Weil Tango @en,Raymond Weil Toccata Watch 5988-P-97081 "Shop Raymond 5388-PC5-65001 Watches | Costello Jewelry Company"
1390,0,Mens Ambit 3 Peak HR Bluetooth GPS Chronograph Watch @de "GPS Uhren | Official Stockist for Uhren"@de,Unisex Forerunner 235 HR GPS Bluetooth Alarm Chronograph Watch @de "Herren Sport Uhren"@de
1391,0,Casio CA-506G-9AEF@bg CA-506G-9AEF | Data Bank Stotak.com"@bg, Montre argentée LA670WEA-7EF - Casio @fr "TIC TAC"@fr
1392,0,Bvlgari Bvlgari Watch BBL37C11SPG 12 BBL33WSS 12 | Dejaun Jewelers",Bvlgari B.Zero1 Watch BZ23WSGDL 12 BZ23BSCL | Dejaun Jewelers"
1393,1,Polar V800 Horloge - Zwart/Zilver@nl " Accessoires Polar Zwart-Zilver Sport Horloges- 92052229 "@nl,Polar V800 HRM GPS Sportklocka@sv "K?p Polar Sportklocka med fri frakt p? n?tet - Skistart.com"@sv
1394,0, ZIIIRO MERCURY CHROME OCEAN @fr-fr  TOKYOFLASH KISAI SPIDER... CELESTE COLORED SATURN MR JONES CYCLOPS SUMMER NIGHT BLADE DARK... ECLIPSE ROSE GOLD SUN AND MOON COUNT DOWN CLOCK BLACK NIGHT... ROSEGOLD PURPLE GUNMETAL MINT MONO "G-SHOCK GA-100MB-1AER"@fr-fr  MARU... DAWN WEST DUSK LEMON THE LAST LAUGH /... SPACE... SATELLITE ADJUST... TIME TRAVELLER LAUGH... ALL GOLD... AVERAGE DAYS GUNMETAL... "@fr-fr GA-100MB-1AER - Chez maman"@fr-fr,Herren Casio G-Shock Wecker Chronograf Uhr GA-100-1A4ER@de
1395,0,Mens 1953 Chronograph Watch @de "Luxusuhren vieler Qualit?tsmarken online | DE Shop?"@de, Mens Sekonda Watch 1350 New arrivals | Shop New The Hut"
1396,0,Montre Palazzo Empire rouge@fr rouge - Versace Femme | Boutique en Ligne France"@fr,Canterbury oro rosa Reloj para mujer 36mm@es "Daniel Wellington Canterbury 36mm nur 139 00 €"@es
1397,1,Morellato Gents Watch Analogue Quartz  Steel and Pink Steel  Rose@en Bracelet | Samuels Jewelers"@en Rose Bezel Quartz,Morellato Gents Watch Analogue Quartz  Steel and Pink Steel  Rose Bezel  Bracelet@en Bracelet - Morellato Watches Jewelry"@en Bezel Quartz
1398,0,Max Bill Reloj para mujer@es "Junghans Max mujer 047/4659.00 nur 495 00 €"@es, Unisex Junghans Max Bill Watch 047/4658.00 Luxury Mens Watches"
1399,0,Unisex Daniel Wellington klassisch Schwarz Reading Uhr 36mm DW00100141@de,Daniel Wellington Classic Lady Black Bristol silver@nl-NL silver | 10:35 Horloge boetiek"@nl-NL
1400,0,Herren Seiko solar betrieben Uhr SNE329P9@de,Seiko Herrenuhr Solar SNE039P1@de
1401,0,Mikimoto Necklaces Necklace PPS1102NDW "Shop Mikimoto MPA10025ADXW | Northeastern Fine Jewelry",Cartier Drive De Cartier Watch W4100013 "Shop WGNM0008 Watches | Northeastern Fine Jewelry"
1402,0,Carl F Bucherer Power Reserve Watch 00.10912.08.13.01 "Shop Carl 00.10912.08.33.01 | Moyer Fine Jewelers",Carl F Bucherer TravelTec II Watch 00.10633.03.33.01 "Shop Carl 00.10633.08.33.21 Watches | Costello Jewelry Company"
1403,1,Casio GA-201-1AER@bg GA-201-1AER | G-Shock Stotak.com"@bg,Casio GA201-1A G-Shock Alarm "Check Web Prices" "Clothing Clothing Accessories Watches"
1404,0,Communion 01 Size 4 SS@en-US "Rosary Centers -- The Rosary Shop"@en-US,Alpina Automatic 4 Watch AL-525BS5AQ6 "Shop Alpina AL-525BS5AQ6B | Moyer Fine Jewelers"
1405,0,Montre Manifesto Gent Courage noire@fr noire - Versace Homme | Boutique en Ligne EU"@fr, Tissot Men's T-One Automatic Watch@en "Men's Watch (T0384301103700) - WATCH SHOP.com?"@en
1406,1,Ladies′ Watch Triest Small@en "Bruno S?hnle Ladies′ Small 17-23183-242 nur € 376.00"@en,Reloj para mujer Triest Small@es "Bruno S?hnle Reloj Small nur 470 00 €"@es
1407,0,Panerai 2013 Watch PAM00446 "Shop Panerai PAM00532 Watches | Northeastern Fine Jewelry",Cartier Ronde Louis Cartier Watch W6800151 "Shop WR000551 Watches | Northeastern Fine Jewelry"
1408,0,Cartier  "CartierCartier Ronde Louis Unisex Gold Watch WR000251",Cartier Tank Louis Cartier Watch W1529756 "Shop WGTA0010 Watches | Northeastern Fine Jewelry"
1409,0,Herren Hamilton Jazzmaster Seaview Chronograf Uhr H37512731@de, Hamilton Ladies' Seaview Quartz Watch@en "Ladies' Watch (H37451141) - WATCH SHOP.com?"@en
1410,0,26-Gauge Silver Floral Paddle Wire: 95 yards@en " 26-Gauge Wire - yards "@en, Nixon Ladies' The Facet 38 Watch@en "Ladies' Watch (A409-1920) - WATCH SHOP.com?"@en
1411,1,Nicoline Ladies′ Watch@en "Skagen Nicoline Watch SKW2075 nur € 139.00"@en,Nicoline Zegarek damski@pl 00 €"@pl "Skagen Nicoline damski SKW2075 nur 139
1412,0,Michele Deco Mid Diamond Gold Watch "Dynamic Filter",Michele Deco Madison Watch MW06T00A0101_MS18AA030402 "Shop Michele MW06T00C9018_MS18AU285048 Watches | Northeastern Fine Jewelry"
1413,0, Maurice Lacroix Men's Pontos Automatic Chronograph Watch@en "Men's Watch (PT6388-SS001-430-1) - WATCH SHOP.com?"@en, Ladies Certina DS-1 Automatic Watch C0062071103100 Ladies Watches | Designer For Women The Hut"
1414,1,Joma Champion III LS Jersey - White/Royal@en " Joma Mens Football Teamwear White/Royal "@en, Mens Coach Bleecker Slim Watch 14602343 New arrivals | Shop New The Hut"
1415,1,Eco-Drive Reloj para hombre@es "Citizen Eco-Drive hombre AW1360-04E nur 139 00 €"@es,Orologio Aviator 98/218 EcoDrive@it "Citizen Orologio EcoDrive AW1360-04E - Colombo Gioielleria"@it
1416,1,Daniel Wellington Classic Man Black Cornwall rose gold@nl-NL gold | 10:35 Horloge boetiek"@nl-NL,Daniel Wellington Classic Man Black Cornwall rose gold@en-GB gold 10:35 Watch boutique"@en-GB
1417,0,Mens G-SHOCK wereldtijd witte hars Strap Watch,G-Shock Reloj para hombre@es "Casio G-Shock hombre GA-400-1BER nur 129 00 €"@es
1418,0, Casio Men's Edifice Time Traveller Bluetooth Hybrid Smartwatch Alarm Chronograph Watch@en "Men's Watch (EQB-500D-1AER) - WATCH SHOP.com?"@en, Unisex Casio Databank Alarm Chronograph Watch DB-360GN-9AEF Mens Sale Watches"
1419,0,Raymond Weil Toccata Watch 5988-P-97081 "Shop Raymond 5388-SPS-97081 Watches | Costello Jewelry Company",Raymond Weil Toccata Watch 5388-PC5-65001 "Shop Raymond 5988-SP5-97081 Watches | Costello Jewelry Company"
1420,0,Dior Montaigne Watch CD151111M001 CD152110A005 | Dejaun Jewelers",Dior Chiffre Rouge Watch CD084510A001 CD084860M001 | Dejaun Jewelers"
1421,0,Cartier  "CartierCartier Tank Francaise Series Men's Watch W51002Q3",Cartier  "CartierCartier Pasha Series Men's Watch W31088U2"
1422,0,Seiko SRP639K1 Prospex Sea watch,Solar Men′s Chronograph@en "Seiko Solar Chronograph SSC437P1 nur € 239.00"@en
1423,0, DAN?EL WELL?NGTON DW00100149 Kol Saati @tr "Daniel Wellington En Ucuz Fiyat"@tr,Daniel Wellington Classic Lady Black Bristol silver@nl-NL silver 10:35 Horloge boektiek"@nl-NL
1424,0,ArtCarved Contemporary Wedding Band 11-WV7365W-G "Shop ArtCarved 11-WV04U85-G bands | Northeastern Fine Jewelry",Cartier Drive De Cartier Watch W4100013 "Shop WGNM0005 Watches | Northeastern Fine Jewelry"
1425,1,Omega Seamaster 22545000 " Discover the Omega watch collection at Albemarle Bond,Omega Seamaster 300m 2254.50.00 2254.50.00 Watch | Watchfinder & Co."
1426,1,Raymond Weil Toccata Watch 5988-ST-00300 "Shop Raymond 5388-PC5-65001 Watches | Costello Jewelry Company",Raymond Weil Toccata Watch 5988-ST-00300 "Shop Raymond 5988-ST-00300 Watches | Costello Jewelry Company"
1427,0, Mens Nixon The Crew Watch A1186-2761 New arrivals | Shop New Hut", Ladies Karl Lagerfeld Joleigh Watch KL3409 Latest Mens Watches"
1428,0,Alpina Pilot Quartz Chronograph Watch AL-372LBBG4FBV6 "Shop Alpina AL-372B4FBS6 | Moyer Fine Jewelers",Alpina STARTIMER CHRONOGRAPH AL-725GR4S6@en
