id,label,left_title,right_title
428,1,Cartier Santos de Cartier Galbée Watch W20012C4 "Shop W20012C4 Watches | Northeastern Fine Jewelry",Cartier Santos W20012C4 W20012C4 Watch | Watchfinder & Co."
429,0,Casio G-Shock GA-100B-7AER@en GA-100B-7AER - Casio Watches"@en,Herren Casio G-Shock Wecker Chronograf Uhr GA-400-1BER@de
430,0,Eco-Drive Men′s Watch@en "Citizen Eco-Drive Watch AW1360-04E nur € 111.20"@en,Daniel Wellington Classic Man York rose gold@en-GB gold 10:35 Watch boutique"@en-GB
431,0,Montre Manifesto Love bleue@fr bleue - Versace Femme | Boutique en Ligne France"@fr,Montre Manifesto Power noire@fr noire - Versace Femme | Boutique en Ligne EU"@fr
432,0, TAG HEUER CARRERA Calibre 5 Day-Date Automatikuhr 100 M - ?41 mm WAR201E.FC6292 @de "TAG Heuer Carrera Automatic Watch 41 | watch price"@de, TAG HEUER AQUARACER（競潛系列） Calibre 5 自動上鏈腕錶 300米 - ?41毫米陶瓷錶圈 WAY211B.FC6363 @zh-hant "TAG Heuer（泰格豪雅） Aquaracer（競潛系列） Automatic Watch 41毫米 | watch price"@zh-hant
433,0,Michele Serein Watch MWW21A000001 "Shop Michele MWW21A000058 Watches | Costello Jewelry Company",IWC Ingenieur Watch IW380802 "Shop IWC IW380703 Watches | Northeastern Fine Jewelry"
434,1,Raymond Weil Maestro Watch 2227-STC-00659 "Shop Raymond 2237-ST-20001 Watches | Costello Jewelry Company",Raymond Weil Maestro Watch 2227-STC-00659 "Shop Raymond 2227-ST-00659 Watches | Costello Jewelry Company"
435,1,Bubble Levels - 34mm Bubble Level@en, Unisex Gucci G-Timeless Watch YA1264040 Luxury Mens Watches"
436,1,Ladies Nabucco BRIT Awards 2014 Limited Edition Titanium Automatic Chronograph Diamond Watch @de "Limited Uhren"@de, Raymond Weil Ladies' Nabucco BRIT Awards 2014 Limited Edition Titanium Automatic Chronograph Diamond Watch@en "Ladies' Watch (7700-TIR-BRIT14) - WATCH SHOP.com?"@en
437,0,Daniel Wellington Dapper Reading rose gold@nl-NL gold | 10:35 Horloge boetiek"@nl-NL,Daniel Wellington Classic Lady Winchester rose gold@en-GB gold 10:35 Watch boutique"@en-GB
438,0, Titanium Comfort Fit Band (8mm) @en "Titanium | Shane Co."@en, Diamond Hoop Earrings @en "Diamond | Shane Co."@en
439,0,Panerai Radiomir 1940 Watch PAM00514 "Shop Panerai PAM00573 Watches | Northeastern Fine Jewelry",IWC Ingenieur Watch IW380802 "Shop IWC IW380701 Watches | Northeastern Fine Jewelry"
440,0,Men′s Chronograph PR100@en "Tissot Men′s PR100 T101.417.11.031.00 nur € 385.00"@en,Mens Couturier Watch @de "Tissot T-klassisch Uhren | Official TISSOT Stockist"@de
441,1, M200 Bluetooth GPS Activity Tracker Heart Rate Monitor Watch @de "Damen-Sportuhren"@de, Unisex Polar M200 Bluetooth GPS Activity Tracker Heart Rate Monitor Alarm Chronograph Watch 90067741 Ladies Watches | Designer For Women The Hut"
442,1,Daniel Wellington Dapper York rose gold@en-GB gold 10:35 Watch boutique"@en-GB,Dapper York Rose Gold 34 mm@en "Daniel Wellington Dapper mm nur € 159.00"@en
443,0,Carl F Bucherer T-Graph Watch 00.10615.08.33.21 "Shop Carl 00.10615.08.13.01 | Moyer Fine Jewelers",Carl F Bucherer ChronoDate Watch 00.10624.08.53.01 "Shop Carl 00.10624.08.33.01 | Moyer Fine Jewelers"
444,1, Daniel Wellington Men's Sheffield 40mm Watch@en "Men's Watch (DW00100007) - WATCH SHOP.com?"@en,Herren Daniel Wellington Sheffield 40mm Uhr DW00100007@de
445,0,Black Manifesto Power Watch@en "Versace Black Watch for Women | US Online Store"@en,Palazzo Empire Uhr Rot@de "Versace Palazzo Rot für Damen | Online Store EU"@de
446,0,Classic Black St Mawes Rosegold 36mm@de 20 €"@de "Daniel Wellington Classic 36mm nur 135,Daniel Wellington Classic Lady Black Sheffield silver@nl-NL silver 10:35 Horloge boektiek"@nl-NL
447,0,Men′s Chronograph T-Race@en "Tissot Men′s T-Race T048.417.27.057.01 nur € 520.00"@en,Quartz T055.417.11.057.00 Tissot PRC 200 Chrono Gent@en "Watch T-Sport Quartz Laguardajoiers official dealer of in Barcelona"@en catalog
448,0,Chopard Mille Miglia Watch 158992-3001 158997-3001 | Dejaun Jewelers",Mens Watch @de "Ben Sherman London | Official Ben Stockist"@de
449,0,G-Shock Mudman Herrenuhr@de "Casio G-Shock Herrenuhr G-9300-1ER nur 199 00 €"@de,Casio G-Shock AW-590-1AER@en AW-590-1AER - Casio Watches"@en
450,1,Cartier Santos-Dumont Watch W2009251 "Shop Cartier Collection at Northeastern Fine Jewelry",Cartier Santos-Dumont Watch W2009251 "Shop Cartier WH100351 Watches | Northeastern Fine Jewelry"
451,1,Casio Edifice EF-121D-1AVEF@en EF-121D-1AVEF - Casio Watches"@en,Casio EF-121D-1AVEF@bg EF-121D-1AVEF | Edifice Stotak.com"@bg
452,0,Chopard Happy Sport Chrono Watch 288499-3001 288499-3008 | Dejaun Jewelers",Chopard Grand Prix De Monaco Watch 168570-9001 161275-5003 | Dejaun Jewelers"
453,0,Ridriogow Oro Rosé Reloj para hombre 40mm@es "Daniel Wellington Ridriogow 40mm nur 119 00 €"@es,York Rosegold Herrenuhr 40mm@de 00 €"@de "Daniel Wellington York 40mm nur 139
454,1,Reloj solar para hombre@es "Seiko Reloj hombre SNE039P1 nur 159 00 €"@es,Zegarek m?ski na s?oneczn? energie@pl 00 €"@pl "Seiko Zegarek energie SNE039P1 nur 159
455,0,York Rosegold Herrenuhr 40mm@de 00 €"@de "Daniel Wellington York 40mm nur 139,Reading Oro Rosé Reloj para mujer 36mm@es "Daniel Wellington Reading 36mm nur 169 00 €"@es
456,0, Hamilton Ladies' Valiant Automatic Watch@en "Ladies' Watch (H39415654) - WATCH SHOP.com?"@en, Hamilton Ladies' Jazzmaster Lady 30mm Watch@en "Ladies' Watch (H42211155) - WATCH SHOP.com?"@en
457,0,Omega Constellation @en 123.10.35.60.02.001 Men's Watch - The Prime Watches."@en, Mens Nixon The Crew Watch A1186-001 Sale | Hut"
458,0,Damenuhr Couturier@de "Tissot Damenuhr Couturier T035.210.11.051.00 nur 310 00 €"@de,Tissot Quartz Chronograph T0354391105100 Gents Watch@en-GB Watch - EanFind"@en-GB
459,0,Herren Casio Pro-Trek Wecker Chronograf Uhr PRG-300-1A2ER@de,Herren Casio G-Shock Wecker Chronograf Uhr GA-110LPA-1AER@de
460,0,Double Down Men′s Watch@en "Diesel Double Watch DZ1440 nur € 99.00"@en,Seiko Herrenuhr Solar SNE039P1@de
461,1,G-Shock Herrenuhr@de "Casio G-Shock Herrenuhr GA-100MB-1AER nur 99 90 €"@de, ZIIIRO MERCURY CHROME OCEAN @fr-fr  TOKYOFLASH KISAI SPIDER... CELESTE COLORED SATURN MR JONES CYCLOPS SUMMER NIGHT BLADE DARK... ECLIPSE ROSE GOLD SUN AND MOON COUNT DOWN CLOCK BLACK NIGHT... ROSEGOLD PURPLE GUNMETAL MINT MONO "G-SHOCK GA-100MB-1AER"@fr-fr  MARU... DAWN WEST DUSK LEMON THE LAST LAUGH /... SPACE... SATELLITE ADJUST... TIME TRAVELLER LAUGH... ALL GOLD... AVERAGE DAYS GUNMETAL... "@fr-fr GA-100MB-1AER - Chez maman"@fr-fr
462,0,Carl F Bucherer TravelTec Watch 00.10620.08.53.01 "Shop Carl 00.10620.12.33.01 Watches | Costello Jewelry Company",Carl F Bucherer T-Graph Watch 00.10615.03.33.21 "Shop Carl 00.10615.08.33.21 | Moyer Fine Jewelers"
463,0, Ladies Skagen Freja Watch 358SSSD Ladies Sale Watches",Max Bill Damenuhr@de "Junghans Max Damenuhr 047/4541.00 nur 495 00 €"@de
464,0, Mens Daniel Wellington St Mawes 40mm Watch DW00100006 All Watches",Glassgow Rose Gold Men′s Watch 40mm@en "Daniel Wellington Glassgow 40mm nur € 119.00"@en
465,1,Montre Tissot T-TOUCH EXPERT SOLAR / Acier Rouge@fr,Tissot T091.420.47.057.00 T-Touch Expert Solar@en Solar official catalog Laguardajoiers dealer of Tissot in Barcelona"@en
466,0,Cartier Tortue Watch WA501012 "Shop Cartier W1556361 Watches | Northeastern Fine Jewelry",Cartier Drive De Cartier Watch W4100013 "Shop WGNM0005 Watches | Northeastern Fine Jewelry"
467,0,Classy Sheffield Roségold Damenuhr 26mm@de 00 €"@de "Daniel Wellington Classy 26mm nur 99,York oro rosa Reloj para hombre 40mm@es "Daniel Wellington York 40mm nur 139 00 €"@es
468,0,Casio GA-201-1AER@bg GA-201-1AER | G-Shock Stotak.com"@bg,G-Shock Herrenuhr@de "Casio G-Shock Herrenuhr GA-800-4AER nur 129 00 €"@de
469,0,ArtCarved Contemporary Wedding Band 11-WV7365W-G "Shop ArtCarved 11-WV7357W-G bands | Northeastern Fine Jewelry",Cartier Tank Américaine Watch WB710009 "Shop Cartier WB710013 Watches | Northeastern Fine Jewelry"
470,0,Herren Casio klassisch Wecker Chronograf Uhr AQ-230A-1DMQYES@de,Unisex Classic Collection Alarm Chronograph Watch @de G-Shock | DE Shop?"@de "Casio Uhr online finden Edifice
471,0,Astron GPS Dual Time Solar Watch@en "Seiko Astron Watch SSE101J1 nur € 2 195.00"@en,Seiko Flightmaster Solar Chronograph 100m Leather Pilots Watch SSC009P3 @en | Dutyfreeislandshop.com"@en
472,0,York Silver Damenuhr 36mm@de "Daniel Wellington York 36mm DW00100055 nur 169 00 €"@de,Classic Black Sheffield Silver 36mm@en "Daniel Wellington Classic 36mm nur € 135.20"@en
473,0,Bvlgari Bvlgari Watch BBL33WSPGD BBL262TBSS.M | Dejaun Jewelers",Bvlgari Bvlgari Watch BBL37C11SPG 12 BBLP26WGL 12 | Dejaun Jewelers"
474,1,Black Manifesto Gent Courage Watch@en "Versace Black Watch for Men | Online Store EU"@en,Manifesto Gent Courage Uhr Schwarz@de "Versace Manifesto Schwarz für Herren | DE Online Store"@de
475,0, Ladies Karl Lagerfeld Joleigh Watch KL3409 Ladies Watches | Designer For Women The Hut", Bruno Sohnle Ladies' Rondograph Lady Watch@en "Ladies' Watch (17-13172-290) - WATCH SHOP.com?"@en
476,1, TAG HEUER FORMULA 1 Calibre 7 Automatic Watch 200 M - ?41 mm WAZ211A.BA0875 @en-us "TAG Heuer Formula 41 | watch price"@en-us, TAG HEUER FORMULA 1 Calibre 7 Relógio Automático 200 M - ?41 mm WAZ211A.BA0875 @pt "TAG Heuer Formula Automatic Watch 41 | watch price"@pt
477,0,Cartier Pasha W31088U2 W31088U2 Watch | Watchfinder & Co.",Cartier Santos W20055D6 W20055D6 Watch | Watchfinder & Co."
478,1,Hamilton Jazzmaster Seaview Day Date H37565131 "H37565131 Hamilton American Classics Mens Auto Watch - AuthenticWatches.com",Jazzmaster Seaview Day Date Automatikuhr@de "Hamilton Jazzmaster Automatikuhr nur 830 00 €"@de
479,1,Michele Deco Watch MWW06P000099 "Shop Michele MW06T01A1105_MS18AU235009 Watches | Costello Jewelry Company",Michele Deco Watch MWW06P000099 "Shop Michele MW06T01A1105_MS18AU235009 Watches | Northeastern Fine Jewelry"
480,0,IWC Aquatimer IW353804 IW353804 Watch | Watchfinder & Co.",Cartier "CartierCartier Classic Santos Series Men's Watch W20099C4"
481,1,Automatik Diver′s Herrenuhr@de "Seiko Automatik Herrenuhr SRP639K1 nur 395 00 €"@de,Seiko SRP639K1 Prospex Sea watch
482,0,Maurice Lacroix Les Classiques Watch LC6098-SS001-120-1 "Shop Maurice LC6098-SS001-130-1 Watches | Costello Jewelry Company",Michele Deco Watch MWW06P000099 "Shop Michele MWW06P000014 Watches | Costello Jewelry Company"
483,0,Hamilton Seaview Day Date Auto H37565131 "Seaview Auto",Herren Hamilton Jazzmaster Seaview Chronograf Uhr H37512731@de
484,0,Chopard Happy Sport Chrono Watch 288499-3001 288499-3008 | Dejaun Jewelers",Chopard Grand Prix De Monaco Watch 168570-9001 168569-9001 | Dejaun Jewelers"
485,0, Ladies Bruno Sohnle Rondograph Lady Watch 17-13172-290 Ladies Watches | Designer For Women The Hut", Mens Sekonda Watch 1350 New arrivals | Shop New The Hut"
486,0,Bristol Silver Ladies′ Watch 36mm@en "Daniel Wellington Bristol 36mm nur € 169.00"@en, Daniel Wellington Ladies' York Silver 36mm Watch@en "Ladies' Watch (DW00100055) - WATCH SHOP.com?"@en
487,1,Ladies Le Locle Automatic Watch @de "Tissot T-klassisch Uhren | Official TISSOT Stockist"@de,Zegarek damski Le Locle@pl 00 €"@pl "Tissot Zegarek Locle T41.1.183.33 nur 475
488,0,Cartier Ronde Solo W6801005 W6801005 Watch | Watchfinder & Co.",Cartier Tank Solo Watch W5200025 "Shop Cartier W5200025 Watches | Northeastern Fine Jewelry"
489,0,Michele Serein Mid Watch MWW21B000015 "Shop Michele MWW21B000026 Watches | Costello Jewelry Company",Michele Deco Mid Watch MWW06V000004 "Shop Michele MWW06V000002 Watches | Northeastern Fine Jewelry"
490,0,Herren Hamilton Jazzmaster Thinline Uhr H38511133@de,Damen Hamilton Jazzmaster Dame 34mm Uhr H32351115@de
491,1,Dior Chiffre Rouge Watch CD084510A001 CD084540R001 | Dejaun Jewelers",Dior Chiffre Rouge Watch CD084510A001 CD084B10M001 | Dejaun Jewelers"
492,0,DKNY NY2287 Stanhope watch,Michael Kors MK8157 Runway watch
493,0, Nixon Unisex The Time Teller Chrono Star Wars Special Edition Chronograph Watch@en "Unisex Watch (A972SW-2378) - WATCH SHOP.com?"@en, Tissot Men's Desire Watch@en "Men's Watch (T52142112) - WATCH SHOP.com?"@en
494,1,Damen Olivia Burton Midi Dial Uhr OB15MD42@de,Olivia Burton Midi Dial Black & Rosegold@nl-NL Rosegold | 10:35 Horloge boetiek"@nl-NL
495,0,Cartier Tank Fran?aise Watch W51008Q3 "Shop Cartier W51008Q3 Watches | Northeastern Fine Jewelry",Cartier Tortue Watch W1556363 "Shop Cartier WA501013 Watches | Northeastern Fine Jewelry"
496,1,Hamilton American Classic JazzMaster Maestro Mens Watch@en Watch - H32716839"@en,Jazzmaster Maestro Automatic chronograph@en "Hamilton Jazzmaster chronograph nur € 1 180.00"@en
497,0,Ladies′ Chronograph PRC200@en "Tissot Ladies′ PRC200 T055.217.16.032.02 nur € 430.00"@en,Tissot Quartz Chronograph T0354391105100 Gents Watch@en-GB Watch - EanFind"@en-GB
498,0, Raymond Weil Ladies' Tango Watch@en "Ladies' Watch (5391-STP-00308) - WATCH SHOP.com?"@en,Raymond Weil Tango Watch 8160-ST-00608 "Shop Raymond 8160-ST-00608 Watches | Costello Jewelry Company"
499,0,Bvlgari Bvlgari Watch BBL33C11SPG 12 BBL26WSS 12 | Dejaun Jewelers",Bvlgari Bvlgari Watch BBL26WSSD BBL37WSSD | Dejaun Jewelers"
500,0,Cartier Santos De Cartier 100 @en,Cartier Ronde Louis Cartier Watch WR000651 "Shop WR000351 Watches | Northeastern Fine Jewelry"
501,1,Daniel Wellington Classic Lady Bristol silver@nl-NL silver 10:35 Horloge boektiek"@nl-NL,Daniel Wellington Classic Lady Bristol silver@en-GB silver 10:35 Watch boutique"@en-GB
502,0,Dior Montaigne Watch CD151111M001 CD1521I0M001 | Dejaun Jewelers",Dior Chiffre Rouge Watch CD084841R001 CD084C10A001 | Dejaun Jewelers"
503,0,Men′s Watch@en "Casio Men′s Watch GA-100B-4AER nur € 99.90"@en,G-Shock Speed Shifter Herrenuhr@de "Casio G-Shock Herrenuhr AW-590-1AER nur 95 00 €"@de
504,0,Ladies Day Dream Watch @de "Folli Follie Uhren und Schmuck | Official FOLLI FOLLIE Stockist"@de,Ladies Freja Watch @de "Skagen Uhren und Schmuck | Official SKAGEN Stockist"@de
505,1,Casio G-Shock GA-100B-7AER@en GA-100B-7AER - Casio Watches"@en,Mens G-SHOCK wereldtijd witte hars Strap Watch
506,0,Orologio Manifesto Courage nero@it Gent nero - Versace Uomo | Shop Online Italia"@it, Unisex Casio Classic Collection Alarm Chronograph Watch LA670WEGB-1BEF Mens Sale Watches"
507,0,Mens Casio Pro-Trek Alarm Chronograph Watch PRG-300-1A2ER,Herren Casio Edifice Zeit Traveller Bluetooth hybrid Smartwatch Wecker Chronograf solarbetrieben Uhren EQB-600D-1A2ER@de
508,1,Parade Hemera Wedding Band R2712-R1-BD "Shop Parade R2225-R1-BD bands | Mitchum Jewelers",Parade Hemera Wedding Band R2712-R1-BD "Shop Parade R3150-R1-BD bands | Mitchum Jewelers"
509,0,G-Shock Men′s Watch@en "Casio G-Shock Watch GA-800-4AER nur € 129.00"@en,Herren Casio G-Shock Wecker Chronograf Uhr GA-400-1BER@de
510,0,Tissot T Touch Classic @en,Tissot T091.420.47.057.00 T-Touch Expert Solar@es "Reloj Tissot Solar catálogo oficial Laguardajoiers distribuidor de en Barcelona"@es
511,0,Chopard Mille Miglia Watch 168997-3001 158992-3001 | Dejaun Jewelers",Chopard Happy Sport Chrono Watch 288499-3001 288499-6001 | Dejaun Jewelers"
512,0,Sheffield Silver Damenuhr 36mm@de "Daniel Wellington Sheffield 36mm nur 169 00 €"@de,Daniel Wellington Classic Man Black Sheffield silver@nl-NL silver | 10:35 Horloge boetiek"@nl-NL
513,0,Daniel Wellington Classic Man Black Bristol silver@nl-NL silver 10:35 Horloge boektiek"@nl-NL,Daniel Wellington Classic Man Black Durham silver@en-GB silver 10:35 Watch boutique"@en-GB
514,0,Meister Pilot Automatikuhr@de 00 €"@de "Junghans Meister Automatikuhr 027/3591.00 nur 2.240,Reloj automático Max Bill@es "Junghans Reloj Bill 027/4701.00 nur 925 00 €"@es
515,0,Signature Deco Gold Diamond  Diamond Dial Watch "Deco",Michele Deco Mid Watch MWW06V000004 "Shop Michele MWW06V000023 Watches | Costello Jewelry Company"
516,0,Radiomir 1940 3 Days - 47mm @de 2013"@de,Panerai Radiomir Watch PAM00505 "Shop Panerai PAM00424 Watches | Northeastern Fine Jewelry"
517,0,Raymond Weil Tango Watch 5591-ST-00607 "Shop Raymond 8160-ST-00300 Watches | Costello Jewelry Company",Raymond Weil Maestro Watch 2237-ST-20001 "Shop Raymond 2237-ST-BEAT2 Watches | Costello Jewelry Company"
518,0, Daniel Wellington Ladies' Bristol Rose 36mm Watch@en "Ladies' Watch (DW00100039) - WATCH SHOP.com?"@en,Classic Black Bristol Oro Rosé 36mm@es "Daniel Wellington Classic 36mm nur 169 00 €"@es
519,0,Omega Seamaster 25418000 " Discover the Omega watch collection at Albemarle Bond,Omega Constellation 12023000 " Luxury Omega watches Pre-loved at Albemarle Bond
520,0,Cartier Pasha W31029M7 W31029M7 Watch | Watchfinder & Co.",Cartier  "CartierCartier Pasha C Steel Black Unisex Watch W31079M7"
521,1,Herren Citizen Eco-Drive Uhr BM7193-07B@de, Mens Citizen Eco-Drive Watch BM7193-07B Sale | The Hut"
522,1,Herrenuhr Automatik@de "Seiko Herrenuhr Automatik SSA231K1 nur 349 00 €"@de,Seiko SSA231K1 Neo Classic@es "Reloj Seiko Classic cal. 4R39. Relojes en barcelona venta online"@es
523,0,ArtCarved Classic Engagement Ring 31-V734ERW-E "Shop ArtCarved 31-V378FRW-E rings | Northeastern Fine Jewelry",ArtCarved Classic Engagement Ring 31-V219ERW-E "Shop ArtCarved 31-V221ERW-E rings | Northeastern Fine Jewelry"
524,0,Bvlgari B.Zero1 Watch BZ23WSGCL 12 BZ23BSCL | Dejaun Jewelers",Bvlgari B.Zero1 Watch BZ23WSGDL 12 12 | Dejaun Jewelers"
525,0, TAG HEUER FORMULA 1（F1系列） 200米 - ?32毫米陶瓷和鑲鑽 WAH1315.BA0868 @zh-hant "TAG Heuer（泰格豪雅） Formula 1 32毫米 | watch price"@zh-hant,Formula 1 200 M - ?41 mm Esfera negra acero  cuarzo
526,1,Mens G-Shock G-Rescue Alarm Chronograph Watch @de "Oversized Uhren online bestellen | DE Shop?"@de,Reloj Casio g-shock G-7900-1ER G-7900-1ER | KronosPA.com"
527,0,Jazzmaster Maestro Automatic chronograph@en "Hamilton Jazzmaster chronograph nur € 1 180.00"@en,JAZZMASTER AUTO CHRONO@es CHRONO - Tomas Colomer"@es
528,0, Hamilton Men's Khaki Field 42mm Automatic Watch@en "Men's Watch (H70555533) - WATCH SHOP.com?"@en,TIMELESS CLASSIC VALIANT AUTO@es AUTO - Tomas Colomer"@es
529,0,Kinetic GMT Reloj para hombre@es 00 €"@es "Seiko Kinetic hombre SUN015P1 nur 479,S?oneczna energia Chronograf m?ski@pl 00 €"@pl "Seiko S?oneczna m?ski SSC431P1 nur 329
530,0,Radiomir 1940 3 Days - 47mm @de 2013"@de,Cartier Santos-Dumont Watch WH100351 "Shop Cartier Collection at Northeastern Fine Jewelry"
531,0,Bvlgari Bvlgari Watch BBL33WSPGD BBL33WSDS 12 | Dejaun Jewelers",Bvlgari Bvlgari Watch BBL33C11SPG 12 BBL26C11SPG 12 | Dejaun Jewelers"
532,0,Astron GPS Dual Time Solaruhr@de 00 €"@de "Seiko Astron Solaruhr SSE101J1 nur 2.195,Solar Men′s Chronograph@en "Seiko Solar Chronograph SSC437P1 nur € 239.00"@en
533,0,Radiomir Composite Black Seal 3 Days Automatic - 45mm @en Panerai watch"@en,Panerai Radiomir 1940 Watch PAM00514 "Shop Panerai PAM00573 Watches | Northeastern Fine Jewelry"
534,0,Alpina Startimer Pilot Automatic Watch AL-725B4S6B "Shop Alpina AL-525NN4S6 | Moyer Fine Jewelers",Alpina Startimer Pilot Automatic Watch AL-725GR4S6 "Shop Alpina AL-525G4TS6 | Moyer Fine Jewelers"
535,0,Cartier  "CartierCartier Tank Francaise Series Men's Watch W51002Q3",Cartier  "CartierCartier Classic Santos Series Men's Watch W20098D6"
536,0,DREAMNIGHT@fr " Swatch? France - Chrono (? 40 47 MM) DREAMNIGHT YCS485GC "@fr,Cronografo T-Sport PRC200 Quartz Gent@it "Tissot Cronografo Gent T055.417.11.057.00 - Colombo Gioielleria"@it
537,0, Unisex Gucci G-Timeless Watch YA1264040 Men's Watches | Designer For Men The Hut", Unisex Swatch Flexiblack Watch LB183B Ladies Watches | Designer For Women The Hut"
538,0,Automatikuhr Max Bill@de "Junghans Automatikuhr Bill 027/4700.00 nur 925 00 €"@de,Herren Junghans Max Bill Automatik Uhr 027/3400.00@de
539,1,Panerai Radiomir Watch PAM00505 "Shop Panerai PAM00323 Watches | Northeastern Fine Jewelry",Radiomir Composite Black Seal 3 Days Automatic - 45mm @de – Panerai-Uhr"@de
540,0,Men′s Chronograph PR100@en "Tissot Men′s PR100 T101.417.11.031.00 nur € 385.00"@en,Herren Tissot Couturier GMT Chronograf Uhr T0354391603100@de
541,0,Hamilton Jazzmaster Thinline Small Second Quartz Watch H38411783 "Shop Hamilton Collection at Safa Jewelers",Hamilton Gent Quartz H32451751 "Gent Quartz"
542,0,Cartier Roadster W62002V3 W62002V3 Watch | Watchfinder & Co.",Cartier "CartierCartier Roadster Series Men's Watch W62041V3"
543,0,Vintage Oversized Watch@en "La Mer Collections Vintage Watch | SHOPBOP SAVE UP TO 30% Use Code: MORE17"@en,Cartier  "CartierCartier Roadster Series Men's Watch W62041V3"
544,0,Suunto M5 Heart Quartz Multi-Sport Watch SS015859000@en,Jazzmaster Open Heart Automatikuhr@de 00 €"@de "Hamilton Jazzmaster Automatikuhr H32565555 nur 725
545,1, Hamilton Men's Jazzmaster Automatic Chronograph Watch@en "Men's Watch (H32596751) - WATCH SHOP.com?"@en,Herren Hamilton Jazzmaster Automatik Chronograf Uhr H32596751@de
546,0,Hamilton American Classic Valiant Quartz Watch H39251194 "Shop Hamilton Collection at Safa Jewelers",Herren Hamilton Jazzmaster Thinline 40mm Uhr H38411783@de
547,1,Herrenuhr@de 90 €"@de "Casio Herrenuhr DB-360GN-9AEF nur 64,Unisex Databank Alarm Chronograph Watch @de G-Shock | DE Shop?"@de "Casio Uhr online finden Edifice
548,0, Unisex Gucci Le Marche Des Merveilles Watch YA1264007 Luxury Mens Watches", Certina Ladies' DS-1 Automatic Watch@en "Ladies' Watch (C0062071103100) - WATCH SHOP.com?"@en
549,0,Chopard Moonphases Watch 161934-5001 161934-5001 | Dejaun Jewelers",Chopard Happy Sport Mini Watch 278509-6003 278509-3002 | Dejaun Jewelers"
550,1, DAN?EL WELL?NGTON DW00100141 Kol Saati @tr "Daniel Wellington En Ucuz Fiyat"@tr,Daniel Wellington Classic Lady Black Reading rose gold@nl-NL gold | 10:35 Horloge boetiek"@nl-NL
551,0,Panerai 2013 Watch PAM00364 "Shop Panerai PAM00538 Watches | Northeastern Fine Jewelry",IWC Ingenieur Watch IW380802 "Shop IWC IW380701 Watches | Northeastern Fine Jewelry"
552,0,V8 Herrenchronograph@de "Tissot V8 Herrenchronograph T106.417.11.042.00 nur 440 00 €"@de,Tradition Damenuhr@de "Tissot Tradition Damenuhr T063.210.11.037.00 nur 310 00 €"@de
553,0,Slim Runway Damenuhr@de 20 €"@de "Michael Kors Slim Damenuhr MK3493 nur 159,Silver Watch@en "Michael Kors Silver Watch | SHOPBOP"@en
554,0, Citizen Ladies' Dress Eco-Drive Watch@en "Ladies' Watch (FE1081-08A) - WATCH SHOP.com?"@en, Citizen Men's Eco-Drive Watch@en "Men's Watch (BM7193-07B) - WATCH SHOP.com?"@en
555,0,Men′s Watch Hagen@en "Skagen Men′s Hagen SKW6216 nur € 189.00"@en,Reloj solar para hombre@es "Seiko Reloj hombre SNE039P1 nur 159 00 €"@es
556,0,The Time Teller Chrono Black Sunray@en "Nixon The Sunray A9722348 nur € 151.20"@en,Zegarek damski The Kensington Leather Rose Gold/White@pl "Nixon Zegarek Gold/White nur 129 00 €"@pl
557,0,Classic Black Bristol Silver 40mm@en "Daniel Wellington Classic 40mm nur € 151.20"@en, DAN?EL WELL?NGTON DW00100145 Kol Saati @tr "Daniel Wellington En Ucuz Fiyat"@tr
558,0,Seiko Prospex Sea Turtle Automatic Divers PADI 200m Watch SRPA21K1 @en SRPA21K | Dutyfreeislandshop.com"@en,Tissot T Classic Le Locle Automatic @en
559,0,Ladies Lady Chic Chronograph Watch @de "Gc Uhren einfach und sicher online bestellen | DE Shop?"@de, Hamilton Ladies' Jazzmaster Lady 30mm Watch@en "Ladies' Watch (H42211155) - WATCH SHOP.com?"@en
560,1,Cartier Tank Fran?aise Watch W51008Q3 "Shop Cartier W51008Q3 Watches | Northeastern Fine Jewelry",Cartier Tank Fran?aise Watch W51008Q3 "Shop Cartier WE110007 Watches | Northeastern Fine Jewelry"
561,1,Raymond Weil Toccata Watch 5988-STP-97081 "Shop Raymond 5388-PC5-65001 Watches | Costello Jewelry Company",Raymond Weil Toccata Watch 5988-STP-97081 "Shop Raymond 5988-ST-00300 Watches | Costello Jewelry Company"
562,0,Baby G Reloj para mujer@es 90 €"@es "Casio Baby mujer BLX-100-7ER nur 79,Vintage LA670WEGB-1BEF Or/Noir - Casio@fr-fr Casio LA670WEGB-1BEF"@fr-fr
563,0, Seiko Sportura SUN015P1 Kinetic watch Seiko - Kinetic", Seiko Men's Kinetic Watch@en "Men's Watch (SKA531P1) - WATCH SHOP.com?"@en
564,1,SUUNTO CORE REGULAR NEGRO NEGRO - Suunto Mexico",Suunto Core Watches@en Watches | Sportsman's Warehouse"@en
565,0,Chopard Hour And Minutes Watch 388532-3002 388531-6004 | Dejaun Jewelers",IWC Aquatimer IW353804 IW353804 Watch | Watchfinder & Co."
566,0,Cartier  "CartierCartier Pasha C Steel Black Unisex Watch W31079M7",Cartier Pasha W31088U2 W31088U2 Watch | Watchfinder & Co."
567,0,Bvlgari Bvlgari Watch BBLP33WGG 12 BBL37WSPG 12 | Dejaun Jewelers",Bvlgari Bvlgari Watch BBL262TBSS 12.M BBL33WSDS 12 | Dejaun Jewelers"
568,1,Carl F Bucherer TravelTec II Watch 00.10633.03.33.01 "Shop Carl 00.10633.08.33.21 | Moyer Fine Jewelers",Carl F Bucherer TravelTec II Watch 00.10633.03.33.01 "Shop Carl 00.10633.08.33.21 Watches | Costello Jewelry Company"
569,1,G-Shock Zegarek m?ski Master of G Oversized@pl 90 €"@pl "Casio G-Shock Oversized nur 99,Herren Casio G-Shock Wecker Chronograf Uhr GA-100-1A1ER@de
570,1, Nixon Unisex The Time Teller Chrono Star Wars Special Edition Chronograph Watch@en "Unisex Watch (A972SW-2378) - WATCH SHOP.com?"@en,The Time Teller Chrono Star Wars C-3PO Z?oty@pl 00 €"@pl "Nixon The Z?oty nur 144
571,0,Max Bill Ladies′ Watch@en "Junghans Max Watch 047/4541.00 nur € 495.00"@en, Junghans Men's max bill Handwinding Mechanical Watch@en "Men's Watch (027/5703.00) - WATCH SHOP.com?"@en
572,1,Cartier Rotonde De Cartier Watch W1556051 "Shop W1556218 Watches | Northeastern Fine Jewelry",Cartier Rotonde de Cartier Watch W1556051 "Shop W1556051 Watches | Northeastern Fine Jewelry"
573,0,Freja Zegarek damski@pl "Skagen Freja damski 358SGGD nur 111 20 €"@pl,Skagen 358SRRD Watch
574,1,Cartier Ronde Louis Cartier Watch W6800151 "Shop WR000651 Watches | Northeastern Fine Jewelry",Cartier Ronde Solo Louis Cartier Ladies Watch W6800151@en-us
575,0,Maurice Lacroix Les Classiques Watch LC6098-SS001-320-1 "Shop Maurice LC6098-SS002-120-1 Watches | Costello Jewelry Company",Klokers KLOK-02 Watch KLOK-02-KLINK-02-380C6 "Shop Klokers KLOK-02-KLINK-01-MC7 Watches | Costello Jewelry Company"
